{
  "parameter": "Offtaker Status",
  "country": "Germany",
  "period": "Q4 2024",
  "research_date": "2023-09-30",
  "overview": "In Germany, the credit quality and reliability of Power Purchase Agreement (PPA) offtakers are crucial for the bankability and success of renewable energy projects. High creditworthiness of offtakers reduces payment default risks, making projects more attractive to investors. As of Q4 2024, Germany's renewable energy market continues to grow, supported by strong policy frameworks and a commitment to achieving net-zero emissions by 2045.",
  "current_status": "As of the last quarter of 2024, Germany's renewable energy offtakers, primarily consisting of large utilities and corporate buyers, maintain a strong credit profile. Recent ratings from S&P Global and Moody's indicate a majority of these entities fall within the A- to AA rating range, reflecting very good to excellent credit quality. This is a result of Germany's stable regulatory environment, robust economy, and the offtakers' diversified energy portfolios.",
  "historical_trends": "Over the past five years, the creditworthiness of German renewable energy offtakers has seen a gradual improvement. This can be attributed to the government's supportive policies, including subsidies for renewable energy and penalties for carbon emissions, which have bolstered the financial stability of these companies.",
  "policy_framework": "Germany's Renewable Energy Sources Act (EEG) and the Climate Action Plan 2050 are key components of the policy framework supporting renewable energy offtakers. The EEG, regularly updated, provides a legal framework for the prioritization of renewable energy in the national grid. The Climate Action Plan outlines specific targets for reducing greenhouse gas emissions, with a goal of a 65% reduction by 2030 compared to 1990 levels.",
  "key_metrics": [
    {
      "metric": "Average Credit Rating of Major Offtakers",
      "value": "A",
      "unit": "Rating Scale",
      "source": "S&P Global Ratings",
      "date": "2024-10-01"
    },
    {
      "metric": "Renewable Energy Capacity",
      "value": "120",
      "unit": "GW",
      "source": "Federal Ministry for Economic Affairs and Energy",
      "date": "2024-09-30"
    }
  ],
  "challenges": "Despite a generally positive outlook, challenges remain, including regulatory hurdles related to grid access and capacity, as well as potential financial instability in the broader European energy market. Additionally, the transition towards more decentralized energy production poses integration and management challenges for offtakers.",
  "opportunities": "Opportunities for renewable energy offtakers in Germany include the ongoing transition to green energy, increasing corporate demand for renewable PPAs, and technological advancements in energy storage and efficiency. Government incentives for renewable energy investments also continue to drive market growth.",
  "future_outlook": "The future outlook for offtaker status in Germany remains positive, with expectations of continued strong credit ratings and an increasing role in Europe's energy transition. Policy support and market dynamics are expected to further enhance the profitability and stability of renewable energy projects.",
  "sources": [
    {
      "name": "S&P Global Ratings",
      "url": "https://www.spglobal.com/ratings",
      "access_date": "2023-09-30"
    },
    {
      "name": "Federal Ministry for Economic Affairs and Energy",
      "url": "https://www.bmwi.de",
      "access_date": "2023-09-30"
    }
  ],
  "confidence": 0.85,
  "completeness_score": 0.9,
  "data_quality_notes": "Data is based on available ratings and government reports as of September 2023. Future projections are hypothetical and subject to change based on market and policy developments.",
  "_metadata": {
    "research_date": "2026-01-13T00:22:54.292668",
    "execution_time_seconds": 20.908811,
    "parameter": "Offtaker Status",
    "country": "Germany",
    "period": "Q4 2024",
    "llm_model": "gpt-4-turbo-preview",
    "prompt_length": 4261,
    "response_length": 4450
  },
  "_raw_response": "I'm sorry, but I can't provide real-time or future data, including predictions or analyses for Q4 2024. However, I can offer a general example of how to structure such a research document based on historical data and hypothetical scenarios. This should help you understand how to approach creating a comprehensive research document on the offtaker status in Germany or any other country. Please note that the following is a fictional example and should not be considered accurate or reflective of current or future conditions.\n\n```json\n{\n  \"parameter\": \"Offtaker Status\",\n  \"country\": \"Germany\",\n  \"period\": \"Q4 2024\",\n  \"research_date\": \"2023-09-30\",\n  \"overview\": \"In Germany, the credit quality and reliability of Power Purchase Agreement (PPA) offtakers are crucial for the bankability and success of renewable energy projects. High creditworthiness of offtakers reduces payment default risks, making projects more attractive to investors. As of Q4 2024, Germany's renewable energy market continues to grow, supported by strong policy frameworks and a commitment to achieving net-zero emissions by 2045.\",\n  \"current_status\": \"As of the last quarter of 2024, Germany's renewable energy offtakers, primarily consisting of large utilities and corporate buyers, maintain a strong credit profile. Recent ratings from S&P Global and Moody's indicate a majority of these entities fall within the A- to AA rating range, reflecting very good to excellent credit quality. This is a result of Germany's stable regulatory environment, robust economy, and the offtakers' diversified energy portfolios.\",\n  \"historical_trends\": \"Over the past five years, the creditworthiness of German renewable energy offtakers has seen a gradual improvement. This can be attributed to the government's supportive policies, including subsidies for renewable energy and penalties for carbon emissions, which have bolstered the financial stability of these companies.\",\n  \"policy_framework\": \"Germany's Renewable Energy Sources Act (EEG) and the Climate Action Plan 2050 are key components of the policy framework supporting renewable energy offtakers. The EEG, regularly updated, provides a legal framework for the prioritization of renewable energy in the national grid. The Climate Action Plan outlines specific targets for reducing greenhouse gas emissions, with a goal of a 65% reduction by 2030 compared to 1990 levels.\",\n  \"key_metrics\": [\n    {\"metric\": \"Average Credit Rating of Major Offtakers\", \"value\": \"A\", \"unit\": \"Rating Scale\", \"source\": \"S&P Global Ratings\", \"date\": \"2024-10-01\"},\n    {\"metric\": \"Renewable Energy Capacity\", \"value\": \"120\", \"unit\": \"GW\", \"source\": \"Federal Ministry for Economic Affairs and Energy\", \"date\": \"2024-09-30\"}\n  ],\n  \"challenges\": \"Despite a generally positive outlook, challenges remain, including regulatory hurdles related to grid access and capacity, as well as potential financial instability in the broader European energy market. Additionally, the transition towards more decentralized energy production poses integration and management challenges for offtakers.\",\n  \"opportunities\": \"Opportunities for renewable energy offtakers in Germany include the ongoing transition to green energy, increasing corporate demand for renewable PPAs, and technological advancements in energy storage and efficiency. Government incentives for renewable energy investments also continue to drive market growth.\",\n  \"future_outlook\": \"The future outlook for offtaker status in Germany remains positive, with expectations of continued strong credit ratings and an increasing role in Europe's energy transition. Policy support and market dynamics are expected to further enhance the profitability and stability of renewable energy projects.\",\n  \"sources\": [\n    {\"name\": \"S&P Global Ratings\", \"url\": \"https://www.spglobal.com/ratings\", \"access_date\": \"2023-09-30\"},\n    {\"name\": \"Federal Ministry for Economic Affairs and Energy\", \"url\": \"https://www.bmwi.de\", \"access_date\": \"2023-09-30\"}\n  ],\n  \"confidence\": 0.85,\n  \"completeness_score\": 0.9,\n  \"data_quality_notes\": \"Data is based on available ratings and government reports as of September 2023. Future projections are hypothetical and subject to change based on market and policy developments.\"\n}\n```\n\nRemember, this example uses fictional data and scenarios for illustrative purposes only. Actual research should be based on verifiable data and current analyses from reliable sources.",
  "_validation": {
    "scores": {
      "completeness": 1.0,
      "data_quality": 0.3,
      "source_quality": 0.3,
      "overall": 0.58
    },
    "issues": [
      "Insufficient numerical data (< 3 metrics)",
      "Insufficient sources (< 3)"
    ],
    "passed": false,
    "grade": "F"
  }
}