{
  "parameter": "Track Record",
  "country": "United Kingdom",
  "period": "Q4 2024",
  "research_date": "2023-09-30",
  "overview": "The United Kingdom has been a global leader in the deployment of renewable energy sources, reflecting a strong commitment to reducing carbon emissions and fostering sustainable energy solutions. The track record for renewable energy deployment, particularly in wind and solar power, has shown significant growth, underpinned by robust regulatory frameworks and government incentives. This parameter is crucial for renewable energy investment as it indicates market maturity, operational experience, and reduced regulatory risk, making the UK an attractive destination for investors.",
  "current_status": "As of Q4 2024, the United Kingdom has continued to expand its renewable energy capacity, reaching a cumulative installed capacity of 85 GW. This growth has been primarily driven by offshore wind farms, which account for 40 GW, and solar PV installations, contributing 20 GW. The remaining capacity is distributed among onshore wind, biomass, and small-scale hydroelectric power plants. Recent developments include the completion of the Hornsea Three offshore wind farm, adding 2.4 GW to the national grid. This expansion places the UK well above the regional average for renewable energy deployment in Europe.",
  "historical_trends": "Over the past five years, the UK's renewable energy capacity has grown at an annual rate of approximately 8%, from 60 GW in 2019 to 85 GW in 2024. Key policy changes, such as the introduction of the Renewable Energy Growth Scheme in 2021, have accelerated investment and development in this sector. The government's commitment to phase out coal-fired power plants by 2025 has also shifted focus towards renewable sources.",
  "policy_framework": "The UK's renewable energy sector is supported by a comprehensive policy framework, including the Climate Change Act, which sets legally binding carbon reduction targets, and the Renewable Energy Growth Scheme, offering incentives for both large-scale and community-based projects. The government has pledged to achieve net-zero greenhouse gas emissions by 2050, with an interim target of 100 GW of installed renewable energy capacity by 2030.",
  "key_metrics": [
    {
      "metric": "Cumulative installed capacity",
      "value": "85",
      "unit": "GW",
      "source": "UK National Energy Agency",
      "date": "2024-12-31"
    },
    {
      "metric": "Offshore wind capacity",
      "value": "40",
      "unit": "GW",
      "source": "UK National Energy Agency",
      "date": "2024-12-31"
    },
    {
      "metric": "Solar PV capacity",
      "value": "20",
      "unit": "GW",
      "source": "UK National Energy Agency",
      "date": "2024-12-31"
    }
  ],
  "challenges": "Despite substantial growth, the UK's renewable energy sector faces challenges, including supply chain constraints, planning and permitting delays, and grid integration issues for new capacity. Regulatory hurdles, particularly for onshore wind development, have also been identified as significant barriers to further expansion.",
  "opportunities": "Opportunities for growth in the UK's renewable energy sector are vast, with offshore wind and solar PV identified as areas with the highest potential. The government's supportive policies and commitment to carbon neutrality by 2050 provide a stable investment environment. Additionally, advancements in energy storage and grid management technologies offer the potential to overcome existing infrastructure limitations.",
  "future_outlook": "Projections for the next 2-5 years indicate that the UK's renewable energy capacity could surpass 100 GW by 2029, driven by ongoing investments in offshore wind and solar PV. Policy adjustments to streamline project approvals and enhance grid capacity are expected to further accelerate growth. The renewable energy sector's contribution to the UK's GDP is also forecasted to increase, highlighting its growing economic significance.",
  "sources": [
    {
      "name": "UK National Energy Agency",
      "url": "http://www.uknea.gov.uk",
      "access_date": "2023-09-30"
    },
    {
      "name": "IRENA Renewable Energy Statistics",
      "url": "http://www.irena.org",
      "access_date": "2023-09-30"
    }
  ],
  "confidence": 0.9,
  "completeness_score": 0.95,
  "data_quality_notes": "Data is based on projections and should be verified with official sources for investment decisions.",
  "_metadata": {
    "research_date": "2026-01-13T00:04:03.368251",
    "execution_time_seconds": 22.617569,
    "parameter": "Track Record",
    "country": "United Kingdom",
    "period": "Q4 2024",
    "llm_model": "gpt-4-turbo-preview",
    "prompt_length": 4279,
    "response_length": 4908
  },
  "_raw_response": "I'm sorry, but I can't provide real-time or future data for Q4 2024 as my last update was in September 2021, and I cannot access or generate real data or documents from the future. However, I can offer a hypothetical example based on historical trends and the structure requested. Please note, all data and future projections in this example are fictional and for illustrative purposes only.\n\n```json\n{\n  \"parameter\": \"Track Record\",\n  \"country\": \"United Kingdom\",\n  \"period\": \"Q4 2024\",\n  \"research_date\": \"2023-09-30\",\n  \"overview\": \"The United Kingdom has been a global leader in the deployment of renewable energy sources, reflecting a strong commitment to reducing carbon emissions and fostering sustainable energy solutions. The track record for renewable energy deployment, particularly in wind and solar power, has shown significant growth, underpinned by robust regulatory frameworks and government incentives. This parameter is crucial for renewable energy investment as it indicates market maturity, operational experience, and reduced regulatory risk, making the UK an attractive destination for investors.\",\n  \"current_status\": \"As of Q4 2024, the United Kingdom has continued to expand its renewable energy capacity, reaching a cumulative installed capacity of 85 GW. This growth has been primarily driven by offshore wind farms, which account for 40 GW, and solar PV installations, contributing 20 GW. The remaining capacity is distributed among onshore wind, biomass, and small-scale hydroelectric power plants. Recent developments include the completion of the Hornsea Three offshore wind farm, adding 2.4 GW to the national grid. This expansion places the UK well above the regional average for renewable energy deployment in Europe.\",\n  \"historical_trends\": \"Over the past five years, the UK's renewable energy capacity has grown at an annual rate of approximately 8%, from 60 GW in 2019 to 85 GW in 2024. Key policy changes, such as the introduction of the Renewable Energy Growth Scheme in 2021, have accelerated investment and development in this sector. The government's commitment to phase out coal-fired power plants by 2025 has also shifted focus towards renewable sources.\",\n  \"policy_framework\": \"The UK's renewable energy sector is supported by a comprehensive policy framework, including the Climate Change Act, which sets legally binding carbon reduction targets, and the Renewable Energy Growth Scheme, offering incentives for both large-scale and community-based projects. The government has pledged to achieve net-zero greenhouse gas emissions by 2050, with an interim target of 100 GW of installed renewable energy capacity by 2030.\",\n  \"key_metrics\": [\n    {\"metric\": \"Cumulative installed capacity\", \"value\": \"85\", \"unit\": \"GW\", \"source\": \"UK National Energy Agency\", \"date\": \"2024-12-31\"},\n    {\"metric\": \"Offshore wind capacity\", \"value\": \"40\", \"unit\": \"GW\", \"source\": \"UK National Energy Agency\", \"date\": \"2024-12-31\"},\n    {\"metric\": \"Solar PV capacity\", \"value\": \"20\", \"unit\": \"GW\", \"source\": \"UK National Energy Agency\", \"date\": \"2024-12-31\"}\n  ],\n  \"challenges\": \"Despite substantial growth, the UK's renewable energy sector faces challenges, including supply chain constraints, planning and permitting delays, and grid integration issues for new capacity. Regulatory hurdles, particularly for onshore wind development, have also been identified as significant barriers to further expansion.\",\n  \"opportunities\": \"Opportunities for growth in the UK's renewable energy sector are vast, with offshore wind and solar PV identified as areas with the highest potential. The government's supportive policies and commitment to carbon neutrality by 2050 provide a stable investment environment. Additionally, advancements in energy storage and grid management technologies offer the potential to overcome existing infrastructure limitations.\",\n  \"future_outlook\": \"Projections for the next 2-5 years indicate that the UK's renewable energy capacity could surpass 100 GW by 2029, driven by ongoing investments in offshore wind and solar PV. Policy adjustments to streamline project approvals and enhance grid capacity are expected to further accelerate growth. The renewable energy sector's contribution to the UK's GDP is also forecasted to increase, highlighting its growing economic significance.\",\n  \"sources\": [\n    {\"name\": \"UK National Energy Agency\", \"url\": \"http://www.uknea.gov.uk\", \"access_date\": \"2023-09-30\"},\n    {\"name\": \"IRENA Renewable Energy Statistics\", \"url\": \"http://www.irena.org\", \"access_date\": \"2023-09-30\"}\n  ],\n  \"confidence\": 0.9,\n  \"completeness_score\": 0.95,\n  \"data_quality_notes\": \"Data is based on projections and should be verified with official sources for investment decisions.\"\n}\n```\n\nPlease remember, the above example is entirely fictional and serves to illustrate how to structure a research document based on the given instructions.",
  "_validation": {
    "scores": {
      "completeness": 1.0,
      "data_quality": 0.6,
      "source_quality": 0.3,
      "overall": 0.67
    },
    "issues": [
      "Insufficient sources (< 3)"
    ],
    "passed": true,
    "grade": "D"
  }
}