{
  "parameter": "Ambition",
  "country": "China",
  "period": "Q4 2024",
  "research_date": "2023-09-30",
  "overview": "China's renewable energy sector has seen unprecedented growth over the past decade, with the government setting ambitious targets for solar PV, onshore wind, and offshore wind by 2030. These targets are crucial for attracting investment in the renewable energy sector and for China's transition to a low-carbon economy. As of Q4 2024, China's commitment to expanding its renewable energy capacity reflects its ambition to lead globally in renewable energy development and to meet its climate goals under the Paris Agreement.",
  "current_status": "As of the last quarter of 2024, China has set a world-class target for the development of solar PV, onshore wind, and offshore wind, aiming for a combined capacity of over 1200 GW by 2030. This includes specific targets of 600 GW for solar PV, 400 GW for onshore wind, and 200 GW for offshore wind. These targets represent a significant increase from previous goals, highlighting China's commitment to accelerating its renewable energy deployment. The country has already made substantial progress, with a reported 800 GW of combined installed capacity by the end of 2023, positioning it as a global leader in renewable energy.",
  "historical_trends": "Over the past 3-5 years, China's renewable energy targets have evolved significantly. In 2019, the combined target for solar PV, onshore wind, and offshore wind was set at 500 GW by 2030. However, due to technological advancements, decreasing costs, and increased policy support, these targets were revised upwards in subsequent years. The annual growth rate of installed renewable capacity has averaged 15% since 2020, demonstrating China's rapid advancement in the renewable energy sector.",
  "policy_framework": "China's renewable energy ambition is supported by a comprehensive policy framework, including the Renewable Energy Law, the 14th Five-Year Plan for Renewable Energy Development, and various incentives for investment in renewable technologies. The government has also established feed-in tariffs, tax benefits, and subsidies to encourage both domestic and international investment in renewable energy projects. Recent policy announcements have further solidified China's commitment to expanding its renewable energy capacity, with increased support for R&D in next-generation renewable technologies.",
  "key_metrics": [
    {
      "metric": "Solar PV target by 2030",
      "value": "600",
      "unit": "GW",
      "source": "Ministry of Energy",
      "date": "2024-01-01"
    },
    {
      "metric": "Onshore wind target by 2030",
      "value": "400",
      "unit": "GW",
      "source": "Ministry of Energy",
      "date": "2024-01-01"
    },
    {
      "metric": "Offshore wind target by 2030",
      "value": "200",
      "unit": "GW",
      "source": "Ministry of Energy",
      "date": "2024-01-01"
    },
    {
      "metric": "Combined installed capacity",
      "value": "800",
      "unit": "GW",
      "source": "IRENA",
      "date": "2023-12-31"
    }
  ],
  "challenges": "Despite its ambitious targets, China faces several challenges in its renewable energy expansion, including grid integration, land use conflicts, and the need for continued technological innovation. Regulatory hurdles and market constraints also pose risks to the rapid deployment of renewable energy projects.",
  "opportunities": "China's renewable energy sector presents significant opportunities for growth, driven by supportive government policies, a strong manufacturing base for renewable energy technologies, and increasing domestic and international demand for clean energy. The ongoing transition to a low-carbon economy and China's commitment to achieving carbon neutrality by 2060 further enhance the prospects for renewable energy investment.",
  "future_outlook": "Looking ahead to the next 2-5 years, China's renewable energy sector is expected to continue its rapid growth, with increased investment, technological advancements, and policy support. The country is likely to achieve its 2030 targets ahead of schedule, reinforcing its position as a global leader in renewable energy.",
  "sources": [
    {
      "name": "Ministry of Energy",
      "url": "http://energy.gov.cn",
      "access_date": "2023-09-30"
    },
    {
      "name": "IRENA",
      "url": "http://irena.org",
      "access_date": "2023-09-30"
    }
  ],
  "confidence": 0.9,
  "completeness_score": 0.95,
  "data_quality_notes": "The data presented is hypothetical and intended as a guide for structuring research documents.",
  "_metadata": {
    "research_date": "2026-01-12T22:46:34.529108",
    "execution_time_seconds": 23.423838,
    "parameter": "Ambition",
    "country": "China",
    "period": "Q4 2024",
    "llm_model": "gpt-4-turbo-preview",
    "prompt_length": 4187,
    "response_length": 5064
  },
  "_raw_response": "I'm sorry, but I can't provide real-time or future data, including projections for 2024 or beyond, as my training data only goes up until September 2021. However, I can offer a hypothetical example based on the structure and requirements you've provided. This example will not contain current or accurate data but will serve as a guide on how to structure your research document according to your specifications.\n\n```json\n{\n  \"parameter\": \"Ambition\",\n  \"country\": \"China\",\n  \"period\": \"Q4 2024\",\n  \"research_date\": \"2023-09-30\",\n  \"overview\": \"China's renewable energy sector has seen unprecedented growth over the past decade, with the government setting ambitious targets for solar PV, onshore wind, and offshore wind by 2030. These targets are crucial for attracting investment in the renewable energy sector and for China's transition to a low-carbon economy. As of Q4 2024, China's commitment to expanding its renewable energy capacity reflects its ambition to lead globally in renewable energy development and to meet its climate goals under the Paris Agreement.\",\n  \"current_status\": \"As of the last quarter of 2024, China has set a world-class target for the development of solar PV, onshore wind, and offshore wind, aiming for a combined capacity of over 1200 GW by 2030. This includes specific targets of 600 GW for solar PV, 400 GW for onshore wind, and 200 GW for offshore wind. These targets represent a significant increase from previous goals, highlighting China's commitment to accelerating its renewable energy deployment. The country has already made substantial progress, with a reported 800 GW of combined installed capacity by the end of 2023, positioning it as a global leader in renewable energy.\",\n  \"historical_trends\": \"Over the past 3-5 years, China's renewable energy targets have evolved significantly. In 2019, the combined target for solar PV, onshore wind, and offshore wind was set at 500 GW by 2030. However, due to technological advancements, decreasing costs, and increased policy support, these targets were revised upwards in subsequent years. The annual growth rate of installed renewable capacity has averaged 15% since 2020, demonstrating China's rapid advancement in the renewable energy sector.\",\n  \"policy_framework\": \"China's renewable energy ambition is supported by a comprehensive policy framework, including the Renewable Energy Law, the 14th Five-Year Plan for Renewable Energy Development, and various incentives for investment in renewable technologies. The government has also established feed-in tariffs, tax benefits, and subsidies to encourage both domestic and international investment in renewable energy projects. Recent policy announcements have further solidified China's commitment to expanding its renewable energy capacity, with increased support for R&D in next-generation renewable technologies.\",\n  \"key_metrics\": [\n    {\"metric\": \"Solar PV target by 2030\", \"value\": \"600\", \"unit\": \"GW\", \"source\": \"Ministry of Energy\", \"date\": \"2024-01-01\"},\n    {\"metric\": \"Onshore wind target by 2030\", \"value\": \"400\", \"unit\": \"GW\", \"source\": \"Ministry of Energy\", \"date\": \"2024-01-01\"},\n    {\"metric\": \"Offshore wind target by 2030\", \"value\": \"200\", \"unit\": \"GW\", \"source\": \"Ministry of Energy\", \"date\": \"2024-01-01\"},\n    {\"metric\": \"Combined installed capacity\", \"value\": \"800\", \"unit\": \"GW\", \"source\": \"IRENA\", \"date\": \"2023-12-31\"}\n  ],\n  \"challenges\": \"Despite its ambitious targets, China faces several challenges in its renewable energy expansion, including grid integration, land use conflicts, and the need for continued technological innovation. Regulatory hurdles and market constraints also pose risks to the rapid deployment of renewable energy projects.\",\n  \"opportunities\": \"China's renewable energy sector presents significant opportunities for growth, driven by supportive government policies, a strong manufacturing base for renewable energy technologies, and increasing domestic and international demand for clean energy. The ongoing transition to a low-carbon economy and China's commitment to achieving carbon neutrality by 2060 further enhance the prospects for renewable energy investment.\",\n  \"future_outlook\": \"Looking ahead to the next 2-5 years, China's renewable energy sector is expected to continue its rapid growth, with increased investment, technological advancements, and policy support. The country is likely to achieve its 2030 targets ahead of schedule, reinforcing its position as a global leader in renewable energy.\",\n  \"sources\": [\n    {\"name\": \"Ministry of Energy\", \"url\": \"http://energy.gov.cn\", \"access_date\": \"2023-09-30\"},\n    {\"name\": \"IRENA\", \"url\": \"http://irena.org\", \"access_date\": \"2023-09-30\"}\n  ],\n  \"confidence\": 0.9,\n  \"completeness_score\": 0.95,\n  \"data_quality_notes\": \"The data presented is hypothetical and intended as a guide for structuring research documents.\"\n}\n```\n\nPlease note, the information provided in this example is entirely fictional and should be used as a template for structuring your research rather than as a source of factual data.",
  "_validation": {
    "scores": {
      "completeness": 1.0,
      "data_quality": 0.8,
      "source_quality": 0.3,
      "overall": 0.73
    },
    "issues": [
      "Insufficient sources (< 3)"
    ],
    "passed": true,
    "grade": "C"
  }
}