{
  "parameter": "Ownership Hurdles",
  "country": "Spain",
  "period": "Q4 2024",
  "research_date": "YYYY-MM-DD",
  "overview": "The renewable energy sector in Spain has historically been open to foreign investment, yet certain regulatory and practical barriers exist that may affect ownership and market participation by international investors. Ownership hurdles are crucial for assessing the country's attractiveness for renewable energy investments as they directly impact the ease with which foreign entities can enter and operate within the market. As of Q4 2024, Spain's regulatory framework and market conditions continue to evolve, reflecting the country's commitment to expanding its renewable energy capacity while balancing national interests and economic policies.",
  "current_status": "As of the latest period, Spain has implemented several reforms aimed at making the renewable energy sector more accessible to foreign investors. However, specific ownership caps, regulatory approvals, and administrative processes may still pose challenges. Recent developments have focused on streamlining these processes, though the exact impact and effectiveness of these changes remain to be fully assessed. Comparison to regional averages indicates that Spain is either in line with or ahead of its European counterparts in terms of openness to foreign investment in renewable energy, depending on the specific subsector and type of investment.",
  "historical_trends": "Over the past 3-5 years, Spain has seen a gradual liberalization of its energy market, with significant policy shifts aimed at attracting more foreign direct investment into renewable energy. Key turning points include regulatory reforms and incentives introduced to encourage solar and wind energy projects. These changes have been partly driven by Spain's commitments under the European Union's renewable energy directives and its own national energy and climate plans.",
  "policy_framework": "The Spanish government has enacted several laws and regulations that directly impact foreign ownership in the renewable energy sector. These include the Energy Sector Law, the Renewable Energy Plan, and various decrees that offer incentives for renewable energy investment. The government has set ambitious targets for renewable energy production, aiming for a substantial increase in capacity by specific future dates. The institutional framework involves multiple agencies at both the national and regional levels, overseeing compliance, approvals, and support for renewable energy projects.",
  "key_metrics": [
    {
      "metric": "Foreign ownership cap in renewable energy sector",
      "value": "Specific value",
      "unit": "%",
      "source": "National energy laws and regulations",
      "date": "YYYY-MM-DD"
    },
    {
      "metric": "Number of renewable energy projects with foreign investment",
      "value": "Specific value",
      "unit": "Number",
      "source": "National renewable energy registry",
      "date": "YYYY-MM-DD"
    }
  ],
  "challenges": "Despite improvements, foreign investors in Spain's renewable energy sector face several challenges, including bureaucratic hurdles, complex regulatory frameworks, and potential local opposition to projects. Additionally, the need for approvals from multiple levels of government can delay project timelines.",
  "opportunities": "Spain offers significant opportunities for renewable energy investors, thanks to its favorable climate conditions for solar and wind energy, supportive government policies, and a growing commitment to transitioning away from fossil fuels. The market is also buoyed by increasing demand for green energy, both domestically and across Europe.",
  "future_outlook": "The outlook for foreign investment in Spain's renewable energy sector remains positive, with expectations for continued policy support and market growth. However, the pace and scale of future developments will likely be influenced by global economic conditions, technological advancements, and Spain's ability to address existing challenges.",
  "sources": [
    {
      "name": "National energy laws and regulations",
      "url": "URL",
      "access_date": "YYYY-MM-DD"
    },
    {
      "name": "OECD FDI Regulatory Restrictiveness Index",
      "url": "URL",
      "access_date": "YYYY-MM-DD"
    }
  ],
  "confidence": 0.8,
  "completeness_score": 0.9,
  "data_quality_notes": "Data is based on available information as of YYYY-MM-DD and may be subject to change.",
  "_metadata": {
    "research_date": "2026-01-13T00:40:01.981143",
    "execution_time_seconds": 23.448691,
    "parameter": "Ownership Hurdles",
    "country": "Spain",
    "period": "Q4 2024",
    "llm_model": "gpt-4-turbo-preview",
    "prompt_length": 4499,
    "response_length": 5067
  },
  "_raw_response": "I'm sorry, but I can't provide real-time or future data, including predictions or analyses for Q4 2024. However, I can offer a general template based on the instructions you've provided, which you can then populate with up-to-date information as it becomes available. This template will follow the structure you've requested but will not contain current data or predictions.\n\n```json\n{\n  \"parameter\": \"Ownership Hurdles\",\n  \"country\": \"Spain\",\n  \"period\": \"Q4 2024\",\n  \"research_date\": \"YYYY-MM-DD\",\n  \"overview\": \"The renewable energy sector in Spain has historically been open to foreign investment, yet certain regulatory and practical barriers exist that may affect ownership and market participation by international investors. Ownership hurdles are crucial for assessing the country's attractiveness for renewable energy investments as they directly impact the ease with which foreign entities can enter and operate within the market. As of Q4 2024, Spain's regulatory framework and market conditions continue to evolve, reflecting the country's commitment to expanding its renewable energy capacity while balancing national interests and economic policies.\",\n  \"current_status\": \"As of the latest period, Spain has implemented several reforms aimed at making the renewable energy sector more accessible to foreign investors. However, specific ownership caps, regulatory approvals, and administrative processes may still pose challenges. Recent developments have focused on streamlining these processes, though the exact impact and effectiveness of these changes remain to be fully assessed. Comparison to regional averages indicates that Spain is either in line with or ahead of its European counterparts in terms of openness to foreign investment in renewable energy, depending on the specific subsector and type of investment.\",\n  \"historical_trends\": \"Over the past 3-5 years, Spain has seen a gradual liberalization of its energy market, with significant policy shifts aimed at attracting more foreign direct investment into renewable energy. Key turning points include regulatory reforms and incentives introduced to encourage solar and wind energy projects. These changes have been partly driven by Spain's commitments under the European Union's renewable energy directives and its own national energy and climate plans.\",\n  \"policy_framework\": \"The Spanish government has enacted several laws and regulations that directly impact foreign ownership in the renewable energy sector. These include the Energy Sector Law, the Renewable Energy Plan, and various decrees that offer incentives for renewable energy investment. The government has set ambitious targets for renewable energy production, aiming for a substantial increase in capacity by specific future dates. The institutional framework involves multiple agencies at both the national and regional levels, overseeing compliance, approvals, and support for renewable energy projects.\",\n  \"key_metrics\": [\n    {\"metric\": \"Foreign ownership cap in renewable energy sector\", \"value\": \"Specific value\", \"unit\": \"%\", \"source\": \"National energy laws and regulations\", \"date\": \"YYYY-MM-DD\"},\n    {\"metric\": \"Number of renewable energy projects with foreign investment\", \"value\": \"Specific value\", \"unit\": \"Number\", \"source\": \"National renewable energy registry\", \"date\": \"YYYY-MM-DD\"}\n  ],\n  \"challenges\": \"Despite improvements, foreign investors in Spain's renewable energy sector face several challenges, including bureaucratic hurdles, complex regulatory frameworks, and potential local opposition to projects. Additionally, the need for approvals from multiple levels of government can delay project timelines.\",\n  \"opportunities\": \"Spain offers significant opportunities for renewable energy investors, thanks to its favorable climate conditions for solar and wind energy, supportive government policies, and a growing commitment to transitioning away from fossil fuels. The market is also buoyed by increasing demand for green energy, both domestically and across Europe.\",\n  \"future_outlook\": \"The outlook for foreign investment in Spain's renewable energy sector remains positive, with expectations for continued policy support and market growth. However, the pace and scale of future developments will likely be influenced by global economic conditions, technological advancements, and Spain's ability to address existing challenges.\",\n  \"sources\": [\n    {\"name\": \"National energy laws and regulations\", \"url\": \"URL\", \"access_date\": \"YYYY-MM-DD\"},\n    {\"name\": \"OECD FDI Regulatory Restrictiveness Index\", \"url\": \"URL\", \"access_date\": \"YYYY-MM-DD\"}\n  ],\n  \"confidence\": 0.8,\n  \"completeness_score\": 0.9,\n  \"data_quality_notes\": \"Data is based on available information as of YYYY-MM-DD and may be subject to change.\"\n}\n```\n\nPlease replace placeholders like `\"Specific value\"`, `\"YYYY-MM-DD\"`, and `\"URL\"` with actual data and sources relevant to your research needs. This template is designed to guide the structure of your analysis and should be adapted based on the latest information available.",
  "_validation": {
    "scores": {
      "completeness": 1.0,
      "data_quality": 0.3,
      "source_quality": 0.3,
      "overall": 0.58
    },
    "issues": [
      "Insufficient numerical data (< 3 metrics)",
      "Insufficient sources (< 3)"
    ],
    "passed": false,
    "grade": "F"
  }
}