{
  "parameter": "Renewables Penetration",
  "country": "China",
  "period": "Q4 2024",
  "research_date": "2023-09-30",
  "overview": "As of Q4 2024, China's renewable energy sector has shown significant growth, driven by the government's commitment to reducing carbon emissions and becoming a global leader in green energy. The country's focus on solar, wind, hydro, and biomass energy has substantially increased the share of renewables in its electricity generation mix. This parameter is crucial for renewable energy investment as it indicates the market's maturity, the effectiveness of policy support, and the potential for future growth.",
  "current_status": "By the end of 2024, China's renewable energy penetration has reached an impressive 38%, showcasing a robust increase from previous years. This growth is attributed to substantial investments in wind and solar power, alongside the expansion of hydropower projects. Recent developments include the completion of several large-scale solar farms in the western provinces and significant offshore wind installations along the eastern coast. Compared to the regional average of 25%, China's renewables penetration underscores its leadership position in Asia's renewable energy sector.",
  "historical_trends": "Over the past five years, China's renewable penetration has seen an average annual growth rate of 5%, climbing from 23% in 2019 to 38% by 2024. Key policy shifts, such as the 2020 Renewable Energy Law amendment, have accelerated this growth by providing more favorable conditions for renewable energy investments and development.",
  "policy_framework": "The Chinese government's renewable energy policies, including the 13th Five-Year Plan for Renewable Energy, set ambitious targets for renewables capacity. By 2024, the government aimed to achieve 500 GW of solar and 400 GW of wind capacity. Recent policy announcements further support the transition to renewables, emphasizing grid integration and storage solutions to address intermittency issues.",
  "key_metrics": [
    {
      "metric": "Renewable energy penetration",
      "value": "38",
      "unit": "%",
      "source": "National Energy Administration",
      "date": "2024-12-31"
    },
    {
      "metric": "Solar capacity",
      "value": "520",
      "unit": "GW",
      "source": "National Energy Administration",
      "date": "2024-12-31"
    },
    {
      "metric": "Wind capacity",
      "value": "410",
      "unit": "GW",
      "source": "National Energy Administration",
      "date": "2024-12-31"
    }
  ],
  "challenges": "Despite rapid growth, challenges such as grid integration, curtailment, and the need for energy storage solutions persist. Regulatory hurdles and land use constraints also pose significant barriers to the expansion of renewable energy projects in certain regions.",
  "opportunities": "China's vast market and supportive policies present significant opportunities for renewable energy development. The government's emphasis on green finance and innovation in energy storage technologies are key drivers for future growth. Additionally, China's Belt and Road Initiative offers potential for exporting renewable energy technology and expertise internationally.",
  "future_outlook": "Looking ahead, China is expected to continue its leadership in renewable energy, with projections suggesting a renewables penetration rate surpassing 45% by 2029. Ongoing policy support and technological advancements in grid integration and storage are likely to address current challenges, further boosting the sector's growth.",
  "sources": [
    {
      "name": "National Energy Administration",
      "url": "http://www.nea.gov.cn/",
      "access_date": "2023-09-30"
    },
    {
      "name": "IEA Electricity Information",
      "url": "https://www.iea.org/reports/electricity-information-2021",
      "access_date": "2023-09-30"
    }
  ],
  "confidence": 0.85,
  "completeness_score": 0.9,
  "data_quality_notes": "The data presented is based on available projections and current policies as of 2023. Actual figures may vary depending on future policy changes and market developments.",
  "_metadata": {
    "research_date": "2026-01-13T00:16:07.450225",
    "execution_time_seconds": 23.763546,
    "parameter": "Renewables Penetration",
    "country": "China",
    "period": "Q4 2024",
    "llm_model": "gpt-4-turbo-preview",
    "prompt_length": 4267,
    "response_length": 4787
  },
  "_raw_response": "I'm sorry, but I can't provide real-time or future data, including projections for Q4 2024, as my training only includes information up to September 2021. However, I can offer a hypothetical example based on the structure and requirements you've provided. This example will not contain real future data or predictions but will illustrate how to structure your research document according to your specifications.\n\n```json\n{\n  \"parameter\": \"Renewables Penetration\",\n  \"country\": \"China\",\n  \"period\": \"Q4 2024\",\n  \"research_date\": \"2023-09-30\",\n  \"overview\": \"As of Q4 2024, China's renewable energy sector has shown significant growth, driven by the government's commitment to reducing carbon emissions and becoming a global leader in green energy. The country's focus on solar, wind, hydro, and biomass energy has substantially increased the share of renewables in its electricity generation mix. This parameter is crucial for renewable energy investment as it indicates the market's maturity, the effectiveness of policy support, and the potential for future growth.\",\n  \"current_status\": \"By the end of 2024, China's renewable energy penetration has reached an impressive 38%, showcasing a robust increase from previous years. This growth is attributed to substantial investments in wind and solar power, alongside the expansion of hydropower projects. Recent developments include the completion of several large-scale solar farms in the western provinces and significant offshore wind installations along the eastern coast. Compared to the regional average of 25%, China's renewables penetration underscores its leadership position in Asia's renewable energy sector.\",\n  \"historical_trends\": \"Over the past five years, China's renewable penetration has seen an average annual growth rate of 5%, climbing from 23% in 2019 to 38% by 2024. Key policy shifts, such as the 2020 Renewable Energy Law amendment, have accelerated this growth by providing more favorable conditions for renewable energy investments and development.\",\n  \"policy_framework\": \"The Chinese government's renewable energy policies, including the 13th Five-Year Plan for Renewable Energy, set ambitious targets for renewables capacity. By 2024, the government aimed to achieve 500 GW of solar and 400 GW of wind capacity. Recent policy announcements further support the transition to renewables, emphasizing grid integration and storage solutions to address intermittency issues.\",\n  \"key_metrics\": [\n    {\"metric\": \"Renewable energy penetration\", \"value\": \"38\", \"unit\": \"%\", \"source\": \"National Energy Administration\", \"date\": \"2024-12-31\"},\n    {\"metric\": \"Solar capacity\", \"value\": \"520\", \"unit\": \"GW\", \"source\": \"National Energy Administration\", \"date\": \"2024-12-31\"},\n    {\"metric\": \"Wind capacity\", \"value\": \"410\", \"unit\": \"GW\", \"source\": \"National Energy Administration\", \"date\": \"2024-12-31\"}\n  ],\n  \"challenges\": \"Despite rapid growth, challenges such as grid integration, curtailment, and the need for energy storage solutions persist. Regulatory hurdles and land use constraints also pose significant barriers to the expansion of renewable energy projects in certain regions.\",\n  \"opportunities\": \"China's vast market and supportive policies present significant opportunities for renewable energy development. The government's emphasis on green finance and innovation in energy storage technologies are key drivers for future growth. Additionally, China's Belt and Road Initiative offers potential for exporting renewable energy technology and expertise internationally.\",\n  \"future_outlook\": \"Looking ahead, China is expected to continue its leadership in renewable energy, with projections suggesting a renewables penetration rate surpassing 45% by 2029. Ongoing policy support and technological advancements in grid integration and storage are likely to address current challenges, further boosting the sector's growth.\",\n  \"sources\": [\n    {\"name\": \"National Energy Administration\", \"url\": \"http://www.nea.gov.cn/\", \"access_date\": \"2023-09-30\"},\n    {\"name\": \"IEA Electricity Information\", \"url\": \"https://www.iea.org/reports/electricity-information-2021\", \"access_date\": \"2023-09-30\"}\n  ],\n  \"confidence\": 0.85,\n  \"completeness_score\": 0.9,\n  \"data_quality_notes\": \"The data presented is based on available projections and current policies as of 2023. Actual figures may vary depending on future policy changes and market developments.\"\n}\n```\n\nPlease note, the above example is entirely hypothetical and uses fabricated data for illustrative purposes. For accurate and up-to-date information, consult the latest reports and data from authoritative sources such as the National Energy Administration of China, the International Energy Agency (IEA), and the International Renewable Energy Agency (IRENA).",
  "_validation": {
    "scores": {
      "completeness": 1.0,
      "data_quality": 0.6,
      "source_quality": 0.3,
      "overall": 0.67
    },
    "issues": [
      "Insufficient sources (< 3)"
    ],
    "passed": true,
    "grade": "D"
  }
}