{
  "parameter": "Offtaker Status",
  "country": "India",
  "period": "Q4 2024",
  "research_date": "YYYY-MM-DD",
  "overview": "The offtaker status in India's renewable energy sector is crucial for assessing the financial health and reliability of entities purchasing power under Power Purchase Agreements (PPAs). Given India's ambitious renewable energy targets, the credit quality of these offtakers\u2014primarily state-owned distribution companies (discoms)\u2014is a significant factor in the bankability of renewable projects. The parameter matters for renewable energy investment as it directly impacts the risk profile of projects and their attractiveness to investors.",
  "current_status": "As of the last available data, India's renewable energy offtakers have shown a mixed credit profile. State discoms, which are the primary offtakers, have historically struggled with financial stress, affecting their creditworthiness. However, efforts to improve their operational efficiencies and financial health have been underway, with varying degrees of success across different states. The central government's interventions, including liquidity infusion schemes, have aimed to alleviate some of the payment risks associated with these offtakers.",
  "historical_trends": "Over the past 3-5 years, there has been a concerted effort to improve the financial status of discoms through various schemes and reforms. Despite these efforts, the financial health of many discoms remains a concern, with significant outstanding dues to renewable energy generators. The trend towards more competitive bidding and the entry of private and international players in the renewable sector have also influenced offtaker agreements and dynamics.",
  "policy_framework": "The Indian government has implemented several policies aimed at improving the financial stability of discoms and ensuring timely payments to renewable energy producers. These include the UDAY scheme, liquidity infusion schemes during the COVID-19 pandemic, and more recently, reforms tied to additional borrowing limits for states. The government has also been promoting the adoption of solar energy through various incentives and targets under the National Solar Mission.",
  "key_metrics": [
    {
      "metric": "Outstanding dues to renewable energy producers",
      "value": "Specific Value",
      "unit": "INR",
      "source": "Ministry of Power",
      "date": "Latest available date"
    },
    {
      "metric": "Credit rating of major discoms",
      "value": "Specific Rating",
      "unit": "Rating Scale",
      "source": "S&P/Moody's/Fitch",
      "date": "Latest available date"
    }
  ],
  "challenges": "The main challenges include the financial distress of several state discoms, regulatory hurdles, and delays in subsidy disbursals. The variability in renewable energy production also poses challenges in terms of grid stability and reliability, affecting offtaker agreements.",
  "opportunities": "Opportunities lie in the growing demand for clean energy, supportive government policies, and the potential for technological advancements to improve grid integration and storage solutions. The entry of private and international players has also brought in fresh capital and expertise.",
  "future_outlook": "The future outlook for India's renewable energy offtaker status is cautiously optimistic. Continued policy support and technological advancements are expected to improve the creditworthiness of discoms and the overall bankability of renewable projects. However, addressing the financial health of discoms remains a critical challenge.",
  "sources": [
    {
      "name": "Ministry of Power",
      "url": "URL",
      "access_date": "YYYY-MM-DD"
    },
    {
      "name": "S&P Global Ratings",
      "url": "URL",
      "access_date": "YYYY-MM-DD"
    },
    {
      "name": "Moody's Ratings",
      "url": "URL",
      "access_date": "YYYY-MM-DD"
    },
    {
      "name": "Fitch Ratings",
      "url": "URL",
      "access_date": "YYYY-MM-DD"
    }
  ],
  "confidence": 0.8,
  "completeness_score": 0.9,
  "data_quality_notes": "Data is based on the latest available reports and financial statements. Future projections are speculative and subject to change based on policy and market developments.",
  "_metadata": {
    "research_date": "2026-01-13T00:23:59.619229",
    "execution_time_seconds": 22.832264,
    "parameter": "Offtaker Status",
    "country": "India",
    "period": "Q4 2024",
    "llm_model": "gpt-4-turbo-preview",
    "prompt_length": 4257,
    "response_length": 4892
  },
  "_raw_response": "I'm sorry, but I can't provide real-time or future data predictions for Q4 2024 or create content based on specific future dates or events that haven't occurred yet. However, I can offer a general framework on how to approach the analysis of the offtaker status in the renewable energy sector in India, which you can adapt and update with current data as needed. \n\n```json\n{\n  \"parameter\": \"Offtaker Status\",\n  \"country\": \"India\",\n  \"period\": \"Q4 2024\",\n  \"research_date\": \"YYYY-MM-DD\",\n  \"overview\": \"The offtaker status in India's renewable energy sector is crucial for assessing the financial health and reliability of entities purchasing power under Power Purchase Agreements (PPAs). Given India's ambitious renewable energy targets, the credit quality of these offtakers\u2014primarily state-owned distribution companies (discoms)\u2014is a significant factor in the bankability of renewable projects. The parameter matters for renewable energy investment as it directly impacts the risk profile of projects and their attractiveness to investors.\",\n  \"current_status\": \"As of the last available data, India's renewable energy offtakers have shown a mixed credit profile. State discoms, which are the primary offtakers, have historically struggled with financial stress, affecting their creditworthiness. However, efforts to improve their operational efficiencies and financial health have been underway, with varying degrees of success across different states. The central government's interventions, including liquidity infusion schemes, have aimed to alleviate some of the payment risks associated with these offtakers.\",\n  \"historical_trends\": \"Over the past 3-5 years, there has been a concerted effort to improve the financial status of discoms through various schemes and reforms. Despite these efforts, the financial health of many discoms remains a concern, with significant outstanding dues to renewable energy generators. The trend towards more competitive bidding and the entry of private and international players in the renewable sector have also influenced offtaker agreements and dynamics.\",\n  \"policy_framework\": \"The Indian government has implemented several policies aimed at improving the financial stability of discoms and ensuring timely payments to renewable energy producers. These include the UDAY scheme, liquidity infusion schemes during the COVID-19 pandemic, and more recently, reforms tied to additional borrowing limits for states. The government has also been promoting the adoption of solar energy through various incentives and targets under the National Solar Mission.\",\n  \"key_metrics\": [\n    {\"metric\": \"Outstanding dues to renewable energy producers\", \"value\": \"Specific Value\", \"unit\": \"INR\", \"source\": \"Ministry of Power\", \"date\": \"Latest available date\"},\n    {\"metric\": \"Credit rating of major discoms\", \"value\": \"Specific Rating\", \"unit\": \"Rating Scale\", \"source\": \"S&P/Moody's/Fitch\", \"date\": \"Latest available date\"}\n  ],\n  \"challenges\": \"The main challenges include the financial distress of several state discoms, regulatory hurdles, and delays in subsidy disbursals. The variability in renewable energy production also poses challenges in terms of grid stability and reliability, affecting offtaker agreements.\",\n  \"opportunities\": \"Opportunities lie in the growing demand for clean energy, supportive government policies, and the potential for technological advancements to improve grid integration and storage solutions. The entry of private and international players has also brought in fresh capital and expertise.\",\n  \"future_outlook\": \"The future outlook for India's renewable energy offtaker status is cautiously optimistic. Continued policy support and technological advancements are expected to improve the creditworthiness of discoms and the overall bankability of renewable projects. However, addressing the financial health of discoms remains a critical challenge.\",\n  \"sources\": [\n    {\"name\": \"Ministry of Power\", \"url\": \"URL\", \"access_date\": \"YYYY-MM-DD\"},\n    {\"name\": \"S&P Global Ratings\", \"url\": \"URL\", \"access_date\": \"YYYY-MM-DD\"},\n    {\"name\": \"Moody's Ratings\", \"url\": \"URL\", \"access_date\": \"YYYY-MM-DD\"},\n    {\"name\": \"Fitch Ratings\", \"url\": \"URL\", \"access_date\": \"YYYY-MM-DD\"}\n  ],\n  \"confidence\": 0.8,\n  \"completeness_score\": 0.9,\n  \"data_quality_notes\": \"Data is based on the latest available reports and financial statements. Future projections are speculative and subject to change based on policy and market developments.\"\n}\n```\n\nPlease note that the above JSON structure is a template and should be filled with the latest available data and analysis relevant to the specified period and parameter. The \"confidence\" and \"completeness_score\" fields are subjective assessments of the analysis's reliability and coverage, which should be adjusted based on the thoroughness of the research and the quality of the data sourced.",
  "_validation": {
    "scores": {
      "completeness": 1.0,
      "data_quality": 0.3,
      "source_quality": 0.8,
      "overall": 0.73
    },
    "issues": [
      "Insufficient numerical data (< 3 metrics)"
    ],
    "passed": true,
    "grade": "C"
  }
}