{
  "parameter": "Support Scheme",
  "country": "United Kingdom",
  "period": "Q4 2024",
  "research_date": "2023-09-30",
  "overview": "As of Q4 2024, the United Kingdom has demonstrated a strong commitment to renewable energy through a variety of support schemes. These mechanisms are crucial for attracting investment, reducing risk, and ensuring the competitiveness of renewable sources in the energy market. The current state of support schemes in the UK reflects a mature and stable environment, conducive to both large-scale and community-based renewable energy projects.",
  "current_status": "The UK's renewable energy sector benefits from a comprehensive range of support schemes, including Contracts for Difference (CfD), which provide long-term price stability for new projects, and the Renewable Heat Incentive (RHI) aimed at increasing heat production from renewable sources. As of Q4 2024, the latest CfD allocation round has secured investments for an additional 5 GW of renewable capacity, with offshore wind and solar PV being the largest beneficiaries. Recent developments also include enhancements to grid access and storage solutions, addressing previous infrastructure constraints.",
  "historical_trends": "Over the past five years, the UK has seen a significant shift towards more competitive and market-driven support mechanisms. The transition from Feed-in Tariffs (FiT) to CfDs marked a pivotal change, encouraging larger and more cost-effective renewable projects. This period also witnessed a substantial increase in renewable capacity, with wind and solar PV installations growing by an average of 8% annually.",
  "policy_framework": "The UK's renewable energy policy framework is anchored by the Climate Change Act, which sets legally binding carbon reduction targets. The Energy Act supports this through specific provisions for renewable energy, including the CfD scheme. The government's commitment to achieving net-zero emissions by 2050 has further solidified the policy landscape, with recent announcements focusing on expanding offshore wind capacity to 40 GW by 2030.",
  "key_metrics": [
    {
      "metric": "New renewable capacity secured by CfD",
      "value": "5",
      "unit": "GW",
      "source": "Department for Business, Energy & Industrial Strategy",
      "date": "2024-10-01"
    },
    {
      "metric": "Annual growth rate of wind and solar PV installations",
      "value": "8",
      "unit": "%",
      "source": "UK Renewable Energy Association",
      "date": "2024-09-30"
    }
  ],
  "challenges": "Despite a robust support framework, the UK's renewable sector faces challenges, including planning and regulatory hurdles that can delay project deployment. Additionally, the integration of high levels of renewable energy into the grid requires significant advancements in storage and grid management technologies.",
  "opportunities": "The UK's commitment to decarbonization and renewable energy expansion presents significant opportunities for investment in emerging technologies, such as floating offshore wind and green hydrogen. The government's focus on innovation and technology development supports this growth potential.",
  "future_outlook": "Looking ahead to the next 2-5 years, the UK's renewable energy sector is expected to continue its growth trajectory, supported by strong policy frameworks and ongoing technological advancements. The expansion of offshore wind capacity and the integration of energy storage solutions are likely to be key areas of focus.",
  "sources": [
    {
      "name": "Department for Business, Energy & Industrial Strategy",
      "url": "https://www.gov.uk/government/organisations/department-for-business-energy-and-industrial-strategy",
      "access_date": "2023-09-30"
    },
    {
      "name": "UK Renewable Energy Association",
      "url": "https://www.r-e-a.net/",
      "access_date": "2023-09-30"
    }
  ],
  "confidence": 0.8,
  "completeness_score": 0.9,
  "data_quality_notes": "The data and forecasts provided are based on the latest available information and government announcements as of September 2023. Actual outcomes may vary based on future policy changes and market developments.",
  "_metadata": {
    "research_date": "2026-01-13T00:29:59.657184",
    "execution_time_seconds": 22.01269,
    "parameter": "Support Scheme",
    "country": "United Kingdom",
    "period": "Q4 2024",
    "llm_model": "gpt-4-turbo-preview",
    "prompt_length": 4134,
    "response_length": 4777
  },
  "_raw_response": "I'm sorry, but I can't provide real-time or future data for the United Kingdom's support schemes for renewable energy in Q4 2024, including specific metrics, policy changes, or forecasts. However, I can offer a hypothetical example based on how such a research document might be structured, using fictional data and sources. This example is purely illustrative and does not reflect real or future policies, data, or outcomes.\n\n```json\n{\n  \"parameter\": \"Support Scheme\",\n  \"country\": \"United Kingdom\",\n  \"period\": \"Q4 2024\",\n  \"research_date\": \"2023-09-30\",\n  \"overview\": \"As of Q4 2024, the United Kingdom has demonstrated a strong commitment to renewable energy through a variety of support schemes. These mechanisms are crucial for attracting investment, reducing risk, and ensuring the competitiveness of renewable sources in the energy market. The current state of support schemes in the UK reflects a mature and stable environment, conducive to both large-scale and community-based renewable energy projects.\",\n  \"current_status\": \"The UK's renewable energy sector benefits from a comprehensive range of support schemes, including Contracts for Difference (CfD), which provide long-term price stability for new projects, and the Renewable Heat Incentive (RHI) aimed at increasing heat production from renewable sources. As of Q4 2024, the latest CfD allocation round has secured investments for an additional 5 GW of renewable capacity, with offshore wind and solar PV being the largest beneficiaries. Recent developments also include enhancements to grid access and storage solutions, addressing previous infrastructure constraints.\",\n  \"historical_trends\": \"Over the past five years, the UK has seen a significant shift towards more competitive and market-driven support mechanisms. The transition from Feed-in Tariffs (FiT) to CfDs marked a pivotal change, encouraging larger and more cost-effective renewable projects. This period also witnessed a substantial increase in renewable capacity, with wind and solar PV installations growing by an average of 8% annually.\",\n  \"policy_framework\": \"The UK's renewable energy policy framework is anchored by the Climate Change Act, which sets legally binding carbon reduction targets. The Energy Act supports this through specific provisions for renewable energy, including the CfD scheme. The government's commitment to achieving net-zero emissions by 2050 has further solidified the policy landscape, with recent announcements focusing on expanding offshore wind capacity to 40 GW by 2030.\",\n  \"key_metrics\": [\n    {\"metric\": \"New renewable capacity secured by CfD\", \"value\": \"5\", \"unit\": \"GW\", \"source\": \"Department for Business, Energy & Industrial Strategy\", \"date\": \"2024-10-01\"},\n    {\"metric\": \"Annual growth rate of wind and solar PV installations\", \"value\": \"8\", \"unit\": \"%\", \"source\": \"UK Renewable Energy Association\", \"date\": \"2024-09-30\"}\n  ],\n  \"challenges\": \"Despite a robust support framework, the UK's renewable sector faces challenges, including planning and regulatory hurdles that can delay project deployment. Additionally, the integration of high levels of renewable energy into the grid requires significant advancements in storage and grid management technologies.\",\n  \"opportunities\": \"The UK's commitment to decarbonization and renewable energy expansion presents significant opportunities for investment in emerging technologies, such as floating offshore wind and green hydrogen. The government's focus on innovation and technology development supports this growth potential.\",\n  \"future_outlook\": \"Looking ahead to the next 2-5 years, the UK's renewable energy sector is expected to continue its growth trajectory, supported by strong policy frameworks and ongoing technological advancements. The expansion of offshore wind capacity and the integration of energy storage solutions are likely to be key areas of focus.\",\n  \"sources\": [\n    {\"name\": \"Department for Business, Energy & Industrial Strategy\", \"url\": \"https://www.gov.uk/government/organisations/department-for-business-energy-and-industrial-strategy\", \"access_date\": \"2023-09-30\"},\n    {\"name\": \"UK Renewable Energy Association\", \"url\": \"https://www.r-e-a.net/\", \"access_date\": \"2023-09-30\"}\n  ],\n  \"confidence\": 0.8,\n  \"completeness_score\": 0.9,\n  \"data_quality_notes\": \"The data and forecasts provided are based on the latest available information and government announcements as of September 2023. Actual outcomes may vary based on future policy changes and market developments.\"\n}\n```\n\nPlease note, this example uses fictional data and should not be used for decision-making purposes. For accurate and up-to-date information on the UK's renewable energy support schemes, consult official government resources and industry reports.",
  "_validation": {
    "scores": {
      "completeness": 1.0,
      "data_quality": 0.3,
      "source_quality": 0.3,
      "overall": 0.58
    },
    "issues": [
      "Insufficient numerical data (< 3 metrics)",
      "Insufficient sources (< 3)"
    ],
    "passed": false,
    "grade": "F"
  }
}