{
  "parameter": "Support Scheme",
  "country": "Germany",
  "period": "Q4 2024",
  "research_date": "YYYY-MM-DD",
  "overview": "Germany has been a global leader in the transition towards renewable energy, underpinned by comprehensive support schemes designed to foster the growth of solar, wind, biomass, and other renewable technologies. These mechanisms are crucial for attracting investment, reducing greenhouse gas emissions, and achieving energy independence. As of Q4 2024, Germany's support schemes have evolved to address new challenges and opportunities in the renewable energy sector, reflecting the country's commitment to achieving its climate targets.",
  "current_status": "As of the latest period, Germany offers a mix of feed-in tariffs (FiTs), auctions for renewable energy capacities, and tax incentives aimed at both large-scale renewable energy projects and small-scale, residential installations. The country has also implemented regulatory measures to streamline the deployment of renewable energy infrastructure. Recent developments include adjustments to the FiT rates and the introduction of technology-neutral auctions, aiming to increase competition and reduce costs for renewable energy production.",
  "historical_trends": "Over the past 5 years, Germany has gradually shifted from a predominantly FiT-based support scheme to a more diversified approach that includes competitive auctions. This transition was aimed at reducing the financial burden on consumers and adapting to the maturing renewable energy market. The country has seen significant growth in renewable energy capacity, with wind and solar PV leading the expansion.",
  "policy_framework": "The German Renewable Energy Sources Act (EEG) serves as the cornerstone of the country's renewable energy policy framework, setting out the legal structure for the support schemes. The EEG has undergone several amendments to adapt to the changing dynamics of the energy market and the evolving needs of the renewable sector. The government has set ambitious targets for renewable energy, aiming for a certain percentage of gross electricity consumption to be generated from renewable sources by 2030.",
  "key_metrics": [
    {
      "metric": "Installed Renewable Capacity",
      "value": "XX",
      "unit": "GW",
      "source": "German Federal Ministry for Economic Affairs and Energy",
      "date": "YYYY-MM-DD"
    },
    {
      "metric": "FiT Rates",
      "value": "XX",
      "unit": "EUR/kWh",
      "source": "German Federal Network Agency",
      "date": "YYYY-MM-DD"
    },
    {
      "metric": "Auction Volume",
      "value": "XX",
      "unit": "GW",
      "source": "German Federal Network Agency",
      "date": "YYYY-MM-DD"
    }
  ],
  "challenges": "Despite the comprehensive support schemes, Germany faces challenges such as grid capacity limitations, bureaucratic hurdles for project approvals, and the phase-out of subsidies for certain technologies. The integration of a growing share of intermittent renewable energy sources into the grid also poses technical and regulatory challenges.",
  "opportunities": "Germany's commitment to decarbonizing its economy and the ongoing technological advancements in renewable energy present significant opportunities for growth. The expansion of electric vehicle infrastructure and the potential for green hydrogen production are among the key drivers for increased demand for renewable energy.",
  "future_outlook": "Looking ahead, Germany is expected to continue refining its support schemes to enhance efficiency, reduce costs, and integrate new technologies. The focus is likely to shift towards enabling energy storage solutions, improving grid infrastructure, and fostering international cooperation for energy security and climate goals.",
  "sources": [
    {
      "name": "German Federal Ministry for Economic Affairs and Energy",
      "url": "https://www.bmwi.de/",
      "access_date": "YYYY-MM-DD"
    },
    {
      "name": "German Federal Network Agency",
      "url": "https://www.bundesnetzagentur.de/",
      "access_date": "YYYY-MM-DD"
    }
  ],
  "confidence": 0.8,
  "completeness_score": 0.9,
  "data_quality_notes": "This document is based on hypothetical data and should be updated with actual values and developments.",
  "_metadata": {
    "research_date": "2026-01-13T00:28:21.556792",
    "execution_time_seconds": 20.057824,
    "parameter": "Support Scheme",
    "country": "Germany",
    "period": "Q4 2024",
    "llm_model": "gpt-4-turbo-preview",
    "prompt_length": 4120,
    "response_length": 4820
  },
  "_raw_response": "I'm sorry, but I can't provide real-time or future data, including predictions for Q4 2024 or any specific metrics, policies, or developments that would occur up to that time. However, I can offer a general template based on how one might structure such a research document using hypothetical or past data as an example. For accurate and up-to-date information, please consult the latest resources from relevant authorities, such as government websites, energy agencies, or reputable news outlets.\n\n```json\n{\n  \"parameter\": \"Support Scheme\",\n  \"country\": \"Germany\",\n  \"period\": \"Q4 2024\",\n  \"research_date\": \"YYYY-MM-DD\",\n  \"overview\": \"Germany has been a global leader in the transition towards renewable energy, underpinned by comprehensive support schemes designed to foster the growth of solar, wind, biomass, and other renewable technologies. These mechanisms are crucial for attracting investment, reducing greenhouse gas emissions, and achieving energy independence. As of Q4 2024, Germany's support schemes have evolved to address new challenges and opportunities in the renewable energy sector, reflecting the country's commitment to achieving its climate targets.\",\n  \"current_status\": \"As of the latest period, Germany offers a mix of feed-in tariffs (FiTs), auctions for renewable energy capacities, and tax incentives aimed at both large-scale renewable energy projects and small-scale, residential installations. The country has also implemented regulatory measures to streamline the deployment of renewable energy infrastructure. Recent developments include adjustments to the FiT rates and the introduction of technology-neutral auctions, aiming to increase competition and reduce costs for renewable energy production.\",\n  \"historical_trends\": \"Over the past 5 years, Germany has gradually shifted from a predominantly FiT-based support scheme to a more diversified approach that includes competitive auctions. This transition was aimed at reducing the financial burden on consumers and adapting to the maturing renewable energy market. The country has seen significant growth in renewable energy capacity, with wind and solar PV leading the expansion.\",\n  \"policy_framework\": \"The German Renewable Energy Sources Act (EEG) serves as the cornerstone of the country's renewable energy policy framework, setting out the legal structure for the support schemes. The EEG has undergone several amendments to adapt to the changing dynamics of the energy market and the evolving needs of the renewable sector. The government has set ambitious targets for renewable energy, aiming for a certain percentage of gross electricity consumption to be generated from renewable sources by 2030.\",\n  \"key_metrics\": [\n    {\"metric\": \"Installed Renewable Capacity\", \"value\": \"XX\", \"unit\": \"GW\", \"source\": \"German Federal Ministry for Economic Affairs and Energy\", \"date\": \"YYYY-MM-DD\"},\n    {\"metric\": \"FiT Rates\", \"value\": \"XX\", \"unit\": \"EUR/kWh\", \"source\": \"German Federal Network Agency\", \"date\": \"YYYY-MM-DD\"},\n    {\"metric\": \"Auction Volume\", \"value\": \"XX\", \"unit\": \"GW\", \"source\": \"German Federal Network Agency\", \"date\": \"YYYY-MM-DD\"}\n  ],\n  \"challenges\": \"Despite the comprehensive support schemes, Germany faces challenges such as grid capacity limitations, bureaucratic hurdles for project approvals, and the phase-out of subsidies for certain technologies. The integration of a growing share of intermittent renewable energy sources into the grid also poses technical and regulatory challenges.\",\n  \"opportunities\": \"Germany's commitment to decarbonizing its economy and the ongoing technological advancements in renewable energy present significant opportunities for growth. The expansion of electric vehicle infrastructure and the potential for green hydrogen production are among the key drivers for increased demand for renewable energy.\",\n  \"future_outlook\": \"Looking ahead, Germany is expected to continue refining its support schemes to enhance efficiency, reduce costs, and integrate new technologies. The focus is likely to shift towards enabling energy storage solutions, improving grid infrastructure, and fostering international cooperation for energy security and climate goals.\",\n  \"sources\": [\n    {\"name\": \"German Federal Ministry for Economic Affairs and Energy\", \"url\": \"https://www.bmwi.de/\", \"access_date\": \"YYYY-MM-DD\"},\n    {\"name\": \"German Federal Network Agency\", \"url\": \"https://www.bundesnetzagentur.de/\", \"access_date\": \"YYYY-MM-DD\"}\n  ],\n  \"confidence\": 0.8,\n  \"completeness_score\": 0.9,\n  \"data_quality_notes\": \"This document is based on hypothetical data and should be updated with actual values and developments.\"\n}\n```\n\nPlease replace placeholders like \"XX\", \"YYYY-MM-DD\", and other hypothetical data with actual figures and dates from credible sources to complete your research.",
  "_validation": {
    "scores": {
      "completeness": 1.0,
      "data_quality": 0.6,
      "source_quality": 0.3,
      "overall": 0.67
    },
    "issues": [
      "Insufficient sources (< 3)"
    ],
    "passed": true,
    "grade": "D"
  }
}