{
  "parameter": "Country Stability",
  "country": "United States",
  "period": "Q4 2024",
  "research_date": "2023-09-30",
  "overview": "Country stability, encompassing both political and economic dimensions, is crucial for assessing the investment climate, particularly in the renewable energy sector. For the United States, stability is underpinned by its mature political system, diversified economy, and robust legal framework. However, it's also influenced by current political dynamics, economic policies, and global geopolitical tensions. The stability of the United States directly impacts renewable energy investment through regulatory certainty, economic incentives, and market predictability.",
  "current_status": "As of the last available data, the United States maintains a high level of stability with minor fluctuations attributed to political cycles, policy changes, and international relations. Recent developments in trade policies, environmental regulations, and fiscal stimulus measures have had mixed impacts on the renewable energy sector. Comparatively, the U.S. often ranks higher in stability than many other countries, supported by its strong governance indicators, but faces challenges in policy consistency across different administrations.",
  "historical_trends": "Over the past 3-5 years, the United States has seen shifts in its stability metrics, largely influenced by political transitions, economic policy shifts, and international trade dynamics. These changes have occasionally introduced volatility in the renewable energy market, affecting investor confidence and regulatory landscapes.",
  "policy_framework": "The U.S. has implemented several policies aimed at bolstering renewable energy, including tax incentives, subsidies, and regulatory support for clean energy technologies. Recent policy announcements have further emphasized the government's commitment to reducing carbon emissions and supporting renewable energy infrastructure development.",
  "key_metrics": [
    {
      "metric": "ECR Score",
      "value": "N/A",
      "unit": "",
      "source": "Euromoney Country Risk",
      "date": "2024-Q4"
    },
    {
      "metric": "World Bank Governance Indicators",
      "value": "N/A",
      "unit": "",
      "source": "World Bank",
      "date": "2024"
    }
  ],
  "challenges": "Key challenges facing renewable energy investments in the United States include regulatory uncertainty due to shifting political landscapes, market competition from fossil fuels, and the need for significant upgrades to energy infrastructure.",
  "opportunities": "Opportunities for renewable energy investment in the United States are driven by technological advancements, supportive state-level policies, and growing consumer demand for clean energy. The federal government's commitment to rejoining international climate agreements also signals a positive direction for the sector.",
  "future_outlook": "Looking ahead to the next 2-5 years, the United States is expected to continue its trajectory towards greater renewable energy adoption, supported by policy incentives and technological innovations. However, political shifts and economic policies will play critical roles in shaping the pace and scale of this transition.",
  "sources": [
    {
      "name": "Euromoney Country Risk",
      "url": "N/A",
      "access_date": "2023-09-30"
    },
    {
      "name": "World Bank Governance Indicators",
      "url": "N/A",
      "access_date": "2023-09-30"
    }
  ],
  "confidence": 0.8,
  "completeness_score": 0.7,
  "data_quality_notes": "The analysis is based on historical trends and available data up to 2023. Future projections are speculative and should be interpreted with caution.",
  "_metadata": {
    "research_date": "2026-01-13T00:00:07.746696",
    "execution_time_seconds": 21.306095,
    "parameter": "Country Stability",
    "country": "United States",
    "period": "Q4 2024",
    "llm_model": "gpt-4-turbo-preview",
    "prompt_length": 4135,
    "response_length": 4331
  },
  "_raw_response": "I'm sorry, but I can't provide real-time or future data predictions for Q4 2024 or create content based on specific future data points, metrics, or outcomes that have not occurred or been documented as of my last update. However, I can offer a general framework on how to approach such a research task based on historical data and trends up to 2023. \n\n---\n\n{\n  \"parameter\": \"Country Stability\",\n  \"country\": \"United States\",\n  \"period\": \"Q4 2024\",\n  \"research_date\": \"2023-09-30\",\n  \"overview\": \"Country stability, encompassing both political and economic dimensions, is crucial for assessing the investment climate, particularly in the renewable energy sector. For the United States, stability is underpinned by its mature political system, diversified economy, and robust legal framework. However, it's also influenced by current political dynamics, economic policies, and global geopolitical tensions. The stability of the United States directly impacts renewable energy investment through regulatory certainty, economic incentives, and market predictability.\",\n  \"current_status\": \"As of the last available data, the United States maintains a high level of stability with minor fluctuations attributed to political cycles, policy changes, and international relations. Recent developments in trade policies, environmental regulations, and fiscal stimulus measures have had mixed impacts on the renewable energy sector. Comparatively, the U.S. often ranks higher in stability than many other countries, supported by its strong governance indicators, but faces challenges in policy consistency across different administrations.\",\n  \"historical_trends\": \"Over the past 3-5 years, the United States has seen shifts in its stability metrics, largely influenced by political transitions, economic policy shifts, and international trade dynamics. These changes have occasionally introduced volatility in the renewable energy market, affecting investor confidence and regulatory landscapes.\",\n  \"policy_framework\": \"The U.S. has implemented several policies aimed at bolstering renewable energy, including tax incentives, subsidies, and regulatory support for clean energy technologies. Recent policy announcements have further emphasized the government's commitment to reducing carbon emissions and supporting renewable energy infrastructure development.\",\n  \"key_metrics\": [\n    {\"metric\": \"ECR Score\", \"value\": \"N/A\", \"unit\": \"\", \"source\": \"Euromoney Country Risk\", \"date\": \"2024-Q4\"},\n    {\"metric\": \"World Bank Governance Indicators\", \"value\": \"N/A\", \"unit\": \"\", \"source\": \"World Bank\", \"date\": \"2024\"}\n  ],\n  \"challenges\": \"Key challenges facing renewable energy investments in the United States include regulatory uncertainty due to shifting political landscapes, market competition from fossil fuels, and the need for significant upgrades to energy infrastructure.\",\n  \"opportunities\": \"Opportunities for renewable energy investment in the United States are driven by technological advancements, supportive state-level policies, and growing consumer demand for clean energy. The federal government's commitment to rejoining international climate agreements also signals a positive direction for the sector.\",\n  \"future_outlook\": \"Looking ahead to the next 2-5 years, the United States is expected to continue its trajectory towards greater renewable energy adoption, supported by policy incentives and technological innovations. However, political shifts and economic policies will play critical roles in shaping the pace and scale of this transition.\",\n  \"sources\": [\n    {\"name\": \"Euromoney Country Risk\", \"url\": \"N/A\", \"access_date\": \"2023-09-30\"},\n    {\"name\": \"World Bank Governance Indicators\", \"url\": \"N/A\", \"access_date\": \"2023-09-30\"}\n  ],\n  \"confidence\": 0.8,\n  \"completeness_score\": 0.7,\n  \"data_quality_notes\": \"The analysis is based on historical trends and available data up to 2023. Future projections are speculative and should be interpreted with caution.\"\n}\n\n---\n\nThis template provides a structure for analyzing the stability of the United States with a focus on renewable energy investment, incorporating historical data, policy analysis, and speculative future outlooks based on trends up to 2023. Actual future data and developments would need to be incorporated by the researcher as they become available.",
  "_validation": {
    "scores": {
      "completeness": 1.0,
      "data_quality": 0.3,
      "source_quality": 0.3,
      "overall": 0.58
    },
    "issues": [
      "Insufficient numerical data (< 3 metrics)",
      "Insufficient sources (< 3)"
    ],
    "passed": false,
    "grade": "F"
  }
}