{
  "parameter": "Energy Dependence",
  "country": "Vietnam",
  "period": "Q4 2024",
  "research_date": "YYYY-MM-DD",
  "overview": "As of the last available data, Vietnam has been rapidly developing its energy sector, with a significant focus on reducing energy dependence through the development of domestic renewable energy sources. Energy dependence is a critical parameter for Vietnam, impacting economic stability, energy security, and the ability to meet its growing energy demand sustainably. The country's efforts to transition to renewable energy sources are driven by the need to curb environmental pollution, reduce greenhouse gas emissions, and decrease reliance on imported fuels.",
  "current_status": "Vietnam's energy sector has seen substantial growth in renewable energy capacity, particularly in solar and wind energy. However, the country still relies on coal and imports of oil and gas to meet its energy needs. The exact percentage of energy dependence as of Q4 2024 would require current data, but historically, Vietnam has been working towards reducing this dependence by investing in renewables and enhancing energy efficiency.",
  "historical_trends": "Over the past 3-5 years, Vietnam has experienced a renewable energy boom, especially in solar power, making it one of the leading countries in solar energy deployment in Southeast Asia. This shift towards renewables has been part of Vietnam's strategy to reduce energy imports and increase energy security. The government has implemented various policies and incentives to attract investment in the renewable energy sector.",
  "policy_framework": "Vietnam's government has introduced several policies aimed at promoting renewable energy, including feed-in tariffs (FiTs), tax incentives, and import duty exemptions for renewable energy technologies. The National Power Development Plan (PDP) outlines the country's strategy to increase the share of renewable energy in its energy mix. Specific targets and numbers have been set in various policy documents, aiming to significantly reduce energy dependence by diversifying energy sources.",
  "key_metrics": [
    {
      "metric": "Renewable energy capacity",
      "value": "N/A",
      "unit": "GW",
      "source": "N/A",
      "date": "N/A"
    },
    {
      "metric": "Energy imports",
      "value": "N/A",
      "unit": "% of total energy consumption",
      "source": "N/A",
      "date": "N/A"
    }
  ],
  "challenges": "Vietnam faces several challenges in reducing its energy dependence, including the need for substantial investment in renewable energy infrastructure, regulatory hurdles, and the technical challenges associated with integrating renewable energy into the national grid. Additionally, the country's rapid economic growth continues to drive up energy demand, putting pressure on its energy resources.",
  "opportunities": "The shift towards renewable energy presents significant opportunities for Vietnam, including the potential for becoming a leader in renewable energy in Southeast Asia, attracting foreign investment, and creating jobs in the renewable energy sector. The global push for sustainability also positions Vietnam favorably in international trade and cooperation.",
  "future_outlook": "The future outlook for Vietnam's energy dependence is cautiously optimistic, with the government's continued commitment to renewable energy and the ongoing global trends favoring renewables. However, achieving significant reductions in energy dependence will require sustained efforts, substantial investments, and overcoming the existing challenges.",
  "sources": [
    {
      "name": "IEA World Energy Balances",
      "url": "N/A",
      "access_date": "N/A"
    },
    {
      "name": "BP Statistical Review of World Energy",
      "url": "N/A",
      "access_date": "N/A"
    },
    {
      "name": "National energy statistics",
      "url": "N/A",
      "access_date": "N/A"
    }
  ],
  "confidence": 0.0,
  "completeness_score": 0.0,
  "data_quality_notes": "This document is based on a hypothetical analysis structure. Actual data for Q4 2024 is not provided due to the limitations of the AI's knowledge cut-off in September 2021. For accurate and up-to-date information, consult the latest energy reports and national statistics.",
  "_metadata": {
    "research_date": "2026-01-13T00:14:32.238136",
    "execution_time_seconds": 22.146235,
    "parameter": "Energy Dependence",
    "country": "Vietnam",
    "period": "Q4 2024",
    "llm_model": "gpt-4-turbo-preview",
    "prompt_length": 4117,
    "response_length": 5064
  },
  "_raw_response": "I'm sorry, but I can't provide real-time or future data for Q4 2024 as my last training data is from September 2021, and I cannot access or predict future events or data updates. However, I can offer a general structure on how to approach this task based on historical and existing data up to 2021. For accurate and up-to-date information, please consult the latest reports from reliable sources like the IEA World Energy Balances, BP Statistical Review of World Energy, and national energy statistics from Vietnam.\n\n```json\n{\n  \"parameter\": \"Energy Dependence\",\n  \"country\": \"Vietnam\",\n  \"period\": \"Q4 2024\",\n  \"research_date\": \"YYYY-MM-DD\",\n  \"overview\": \"As of the last available data, Vietnam has been rapidly developing its energy sector, with a significant focus on reducing energy dependence through the development of domestic renewable energy sources. Energy dependence is a critical parameter for Vietnam, impacting economic stability, energy security, and the ability to meet its growing energy demand sustainably. The country's efforts to transition to renewable energy sources are driven by the need to curb environmental pollution, reduce greenhouse gas emissions, and decrease reliance on imported fuels.\",\n  \"current_status\": \"Vietnam's energy sector has seen substantial growth in renewable energy capacity, particularly in solar and wind energy. However, the country still relies on coal and imports of oil and gas to meet its energy needs. The exact percentage of energy dependence as of Q4 2024 would require current data, but historically, Vietnam has been working towards reducing this dependence by investing in renewables and enhancing energy efficiency.\",\n  \"historical_trends\": \"Over the past 3-5 years, Vietnam has experienced a renewable energy boom, especially in solar power, making it one of the leading countries in solar energy deployment in Southeast Asia. This shift towards renewables has been part of Vietnam's strategy to reduce energy imports and increase energy security. The government has implemented various policies and incentives to attract investment in the renewable energy sector.\",\n  \"policy_framework\": \"Vietnam's government has introduced several policies aimed at promoting renewable energy, including feed-in tariffs (FiTs), tax incentives, and import duty exemptions for renewable energy technologies. The National Power Development Plan (PDP) outlines the country's strategy to increase the share of renewable energy in its energy mix. Specific targets and numbers have been set in various policy documents, aiming to significantly reduce energy dependence by diversifying energy sources.\",\n  \"key_metrics\": [\n    {\"metric\": \"Renewable energy capacity\", \"value\": \"N/A\", \"unit\": \"GW\", \"source\": \"N/A\", \"date\": \"N/A\"},\n    {\"metric\": \"Energy imports\", \"value\": \"N/A\", \"unit\": \"% of total energy consumption\", \"source\": \"N/A\", \"date\": \"N/A\"}\n  ],\n  \"challenges\": \"Vietnam faces several challenges in reducing its energy dependence, including the need for substantial investment in renewable energy infrastructure, regulatory hurdles, and the technical challenges associated with integrating renewable energy into the national grid. Additionally, the country's rapid economic growth continues to drive up energy demand, putting pressure on its energy resources.\",\n  \"opportunities\": \"The shift towards renewable energy presents significant opportunities for Vietnam, including the potential for becoming a leader in renewable energy in Southeast Asia, attracting foreign investment, and creating jobs in the renewable energy sector. The global push for sustainability also positions Vietnam favorably in international trade and cooperation.\",\n  \"future_outlook\": \"The future outlook for Vietnam's energy dependence is cautiously optimistic, with the government's continued commitment to renewable energy and the ongoing global trends favoring renewables. However, achieving significant reductions in energy dependence will require sustained efforts, substantial investments, and overcoming the existing challenges.\",\n  \"sources\": [\n    {\"name\": \"IEA World Energy Balances\", \"url\": \"N/A\", \"access_date\": \"N/A\"},\n    {\"name\": \"BP Statistical Review of World Energy\", \"url\": \"N/A\", \"access_date\": \"N/A\"},\n    {\"name\": \"National energy statistics\", \"url\": \"N/A\", \"access_date\": \"N/A\"}\n  ],\n  \"confidence\": 0.0,\n  \"completeness_score\": 0.0,\n  \"data_quality_notes\": \"This document is based on a hypothetical analysis structure. Actual data for Q4 2024 is not provided due to the limitations of the AI's knowledge cut-off in September 2021. For accurate and up-to-date information, consult the latest energy reports and national statistics.\"\n}\n```\n\nThis JSON structure provides a framework for analyzing Vietnam's energy dependence with sections allocated for an overview, current status, historical trends, policy framework, key metrics, challenges, opportunities, future outlook, and sources. Each section is designed to be filled with up-to-date data and analysis based on the latest available reports and statistics.",
  "_validation": {
    "scores": {
      "completeness": 1.0,
      "data_quality": 0.3,
      "source_quality": 0.6,
      "overall": 0.6699999999999999
    },
    "issues": [
      "Insufficient numerical data (< 3 metrics)"
    ],
    "passed": true,
    "grade": "D"
  }
}