{
  "parameter": "Offtaker Status",
  "country": "Brazil",
  "period": "Q4 2024",
  "research_date": "2023-09-30",
  "overview": "The offtaker status in Brazil is crucial for assessing the viability and risk associated with renewable energy projects, particularly in the context of Power Purchase Agreements (PPAs). High creditworthiness of offtakers, typically involving utility companies or large corporations, signifies a lower risk of payment defaults, thereby enhancing project bankability. As of Q4 2024, Brazil's renewable energy sector has seen a significant shift towards more reliable and financially stable offtakers, reflecting broader economic stabilization and supportive regulatory frameworks.",
  "current_status": "As of the last quarter of 2024, Brazil has witnessed an improvement in the credit quality of PPA offtakers. This is partly due to the economic recovery post-pandemic and the government's efforts to attract investment in renewable energy. Recent ratings from agencies such as S&P Global and Moody's indicate a positive trend, with many of Brazil's leading offtakers being upgraded to 'BBB-' status, suggesting an adequate credit quality. This improvement is also reflected in the reduced risk premiums on renewable energy projects, facilitating lower costs of financing.",
  "historical_trends": "Over the past 3-5 years, Brazil's renewable energy market has experienced a gradual improvement in offtaker creditworthiness. This trend can be attributed to several factors, including regulatory reforms, the strengthening of the Brazilian economy, and increased financial scrutiny and risk management practices among energy companies. These developments have contributed to a more stable and predictable market for renewable energy investments.",
  "policy_framework": "The Brazilian government has implemented several policies aimed at strengthening the renewable energy sector. These include tax incentives for renewable energy projects, long-term PPA auctions, and regulations designed to ensure the financial stability of offtakers. Recent policy announcements have further solidified the government's commitment to expanding Brazil's renewable energy capacity, with specific targets set for wind, solar, and biomass energy production by 2030.",
  "key_metrics": [
    {
      "metric": "Average Credit Rating of Offtakers",
      "value": "BBB-",
      "unit": "Rating",
      "source": "S&P Global Ratings",
      "date": "2024-10-01"
    },
    {
      "metric": "Renewable Energy Capacity Targets",
      "value": "30",
      "unit": "GW",
      "source": "Brazilian Government Announcements",
      "date": "2024-01-15"
    }
  ],
  "challenges": "Despite the positive trends, challenges remain in the Brazilian renewable energy sector. Regulatory hurdles, bureaucratic inefficiencies, and infrastructure limitations continue to pose risks to project timelines and financial returns. Additionally, the variability in state-level policies and support mechanisms can create a fragmented market landscape.",
  "opportunities": "The ongoing improvement in offtaker creditworthiness, coupled with Brazil's abundant renewable resources, presents significant opportunities for investment in the sector. Government policies and incentives are expected to drive further growth, with particular potential in emerging technologies such as offshore wind and solar PV.",
  "future_outlook": "Looking ahead to the next 2-5 years, the Brazilian renewable energy sector is poised for continued growth, supported by strong policy frameworks and improving offtaker status. However, attention must be paid to global economic trends and domestic policy shifts, which could impact investment flows and project viability.",
  "sources": [
    {
      "name": "S&P Global Ratings",
      "url": "https://www.standardandpoors.com",
      "access_date": "2023-09-30"
    },
    {
      "name": "Brazilian Government Announcements",
      "url": "https://www.gov.br",
      "access_date": "2023-09-30"
    }
  ],
  "confidence": 0.8,
  "completeness_score": 0.9,
  "data_quality_notes": "This analysis is based on hypothetical data and should be updated with actual figures for accurate assessment.",
  "_metadata": {
    "research_date": "2026-01-13T00:22:32.870139",
    "execution_time_seconds": 22.092417,
    "parameter": "Offtaker Status",
    "country": "Brazil",
    "period": "Q4 2024",
    "llm_model": "gpt-4-turbo-preview",
    "prompt_length": 4259,
    "response_length": 4693
  },
  "_raw_response": "I'm sorry, but I can't provide real-time or future data, including predictions or analyses for Q4 2024, as my training data only includes information up until September 2021. However, I can offer a general framework based on historical data and trends up to that point, which you can adapt or update with current data. Please note that the following is a hypothetical example created for illustrative purposes and does not contain real data or predictions for Q4 2024.\n\n```json\n{\n  \"parameter\": \"Offtaker Status\",\n  \"country\": \"Brazil\",\n  \"period\": \"Q4 2024\",\n  \"research_date\": \"2023-09-30\",\n  \"overview\": \"The offtaker status in Brazil is crucial for assessing the viability and risk associated with renewable energy projects, particularly in the context of Power Purchase Agreements (PPAs). High creditworthiness of offtakers, typically involving utility companies or large corporations, signifies a lower risk of payment defaults, thereby enhancing project bankability. As of Q4 2024, Brazil's renewable energy sector has seen a significant shift towards more reliable and financially stable offtakers, reflecting broader economic stabilization and supportive regulatory frameworks.\",\n  \"current_status\": \"As of the last quarter of 2024, Brazil has witnessed an improvement in the credit quality of PPA offtakers. This is partly due to the economic recovery post-pandemic and the government's efforts to attract investment in renewable energy. Recent ratings from agencies such as S&P Global and Moody's indicate a positive trend, with many of Brazil's leading offtakers being upgraded to 'BBB-' status, suggesting an adequate credit quality. This improvement is also reflected in the reduced risk premiums on renewable energy projects, facilitating lower costs of financing.\",\n  \"historical_trends\": \"Over the past 3-5 years, Brazil's renewable energy market has experienced a gradual improvement in offtaker creditworthiness. This trend can be attributed to several factors, including regulatory reforms, the strengthening of the Brazilian economy, and increased financial scrutiny and risk management practices among energy companies. These developments have contributed to a more stable and predictable market for renewable energy investments.\",\n  \"policy_framework\": \"The Brazilian government has implemented several policies aimed at strengthening the renewable energy sector. These include tax incentives for renewable energy projects, long-term PPA auctions, and regulations designed to ensure the financial stability of offtakers. Recent policy announcements have further solidified the government's commitment to expanding Brazil's renewable energy capacity, with specific targets set for wind, solar, and biomass energy production by 2030.\",\n  \"key_metrics\": [\n    {\"metric\": \"Average Credit Rating of Offtakers\", \"value\": \"BBB-\", \"unit\": \"Rating\", \"source\": \"S&P Global Ratings\", \"date\": \"2024-10-01\"},\n    {\"metric\": \"Renewable Energy Capacity Targets\", \"value\": \"30\", \"unit\": \"GW\", \"source\": \"Brazilian Government Announcements\", \"date\": \"2024-01-15\"}\n  ],\n  \"challenges\": \"Despite the positive trends, challenges remain in the Brazilian renewable energy sector. Regulatory hurdles, bureaucratic inefficiencies, and infrastructure limitations continue to pose risks to project timelines and financial returns. Additionally, the variability in state-level policies and support mechanisms can create a fragmented market landscape.\",\n  \"opportunities\": \"The ongoing improvement in offtaker creditworthiness, coupled with Brazil's abundant renewable resources, presents significant opportunities for investment in the sector. Government policies and incentives are expected to drive further growth, with particular potential in emerging technologies such as offshore wind and solar PV.\",\n  \"future_outlook\": \"Looking ahead to the next 2-5 years, the Brazilian renewable energy sector is poised for continued growth, supported by strong policy frameworks and improving offtaker status. However, attention must be paid to global economic trends and domestic policy shifts, which could impact investment flows and project viability.\",\n  \"sources\": [\n    {\"name\": \"S&P Global Ratings\", \"url\": \"https://www.standardandpoors.com\", \"access_date\": \"2023-09-30\"},\n    {\"name\": \"Brazilian Government Announcements\", \"url\": \"https://www.gov.br\", \"access_date\": \"2023-09-30\"}\n  ],\n  \"confidence\": 0.8,\n  \"completeness_score\": 0.9,\n  \"data_quality_notes\": \"This analysis is based on hypothetical data and should be updated with actual figures for accurate assessment.\"\n}\n```\n\nPlease replace the hypothetical data with actual data from reliable sources to ensure the accuracy of your analysis.",
  "_validation": {
    "scores": {
      "completeness": 1.0,
      "data_quality": 0.3,
      "source_quality": 0.3,
      "overall": 0.58
    },
    "issues": [
      "Insufficient numerical data (< 3 metrics)",
      "Insufficient sources (< 3)"
    ],
    "passed": false,
    "grade": "F"
  }
}