{
  "parameter": "Energy Dependence",
  "country": "United States",
  "period": "Q4 2024",
  "research_date": "2021-09-30",
  "overview": "The United States has historically been a significant consumer of energy, with a diverse mix of domestic and imported sources. Energy dependence is a critical parameter for understanding the country's energy security and its implications for renewable energy investment. Lower energy import dependence is indicative of greater energy security and potentially more favorable conditions for the development of domestic renewable energy sources. As of my last update, the U.S. was making strides towards reducing its dependence on imported energy, primarily through increased production of natural gas, oil, and renewable energy sources.",
  "current_status": "As of the last data point in 2021, the United States had seen a notable shift towards energy independence, largely due to the boom in domestic shale oil and gas production, as well as significant investments in renewable energy. The U.S. Energy Information Administration (EIA) reported a decrease in net energy imports, moving the country closer to a net exporter status. The growth in renewable energy capacity, including solar and wind, has also contributed to reducing the reliance on energy imports. However, the U.S. still imports certain types of energy, including crude oil from Canada and other countries.",
  "historical_trends": "Over the past 3-5 years leading up to 2021, the United States experienced a significant transformation in its energy landscape. The surge in shale gas and oil production, facilitated by advancements in drilling technology, has been a major factor in reducing energy imports. Concurrently, there has been a steady increase in renewable energy capacity, supported by federal and state policies encouraging renewable energy development. These trends have contributed to a gradual decline in energy import dependency.",
  "policy_framework": "The U.S. federal government, along with various state governments, has implemented a range of policies aimed at reducing energy dependence and promoting renewable energy. These include tax incentives for renewable energy projects, renewable portfolio standards (RPS) in many states, and federal emissions regulations encouraging cleaner energy sources. The Biden administration has also proposed ambitious climate and energy policies that could further accelerate the transition towards renewable energy and reduce dependence on imported energy.",
  "key_metrics": [
    {
      "metric": "Net Energy Imports",
      "value": "Data not available for 2024",
      "unit": "%",
      "source": "EIA",
      "date": "2021"
    },
    {
      "metric": "Renewable Energy Capacity",
      "value": "Data not available for 2024",
      "unit": "GW",
      "source": "EIA",
      "date": "2021"
    }
  ],
  "challenges": "Despite progress, the United States faces several challenges in further reducing energy dependence. These include logistical and infrastructure limitations in integrating renewable energy into the national grid, regulatory hurdles, and the ongoing need for imported oil for transportation and industry. Additionally, geopolitical factors and global market dynamics continue to influence the U.S. energy import dependency.",
  "opportunities": "The ongoing transition to renewable energy offers significant opportunities for reducing energy dependence. Continued technological advancements in renewable energy, battery storage, and energy efficiency, along with supportive policies, could further decrease the need for imported energy. Additionally, the growth of the electric vehicle market represents a potential reduction in oil imports for transportation.",
  "future_outlook": "Looking ahead to the next 2-5 years, the United States is expected to continue its trajectory towards reduced energy dependence, driven by growth in renewable energy and advancements in energy technologies. Policy decisions and market developments will play crucial roles in shaping the future energy landscape. While specific data for Q4 2024 is not available, the trends suggest an ongoing decrease in energy import dependency, with renewable energy playing an increasingly significant role.",
  "sources": [
    {
      "name": "EIA",
      "url": "https://www.eia.gov/",
      "access_date": "2021-09-30"
    },
    {
      "name": "BP Statistical Review of World Energy",
      "url": "http://www.bp.com/statisticalreview",
      "access_date": "2021-09-30"
    }
  ],
  "confidence": 0.8,
  "completeness_score": 0.7,
  "data_quality_notes": "The analysis is based on historical data and trends up to 2021. Future projections are speculative and should be updated with actual data when available.",
  "_metadata": {
    "research_date": "2026-01-13T00:12:13.152743",
    "execution_time_seconds": 23.896093,
    "parameter": "Energy Dependence",
    "country": "United States",
    "period": "Q4 2024",
    "llm_model": "gpt-4-turbo-preview",
    "prompt_length": 4129,
    "response_length": 5290
  },
  "_raw_response": "I'm sorry, but I can't provide real-time or future data predictions for Q4 2024 or generate content based on such specific future dates as my training only includes knowledge up to September 2021. However, I can offer a general framework based on historical data and trends up to that point, which you can adapt or update with future data when available. \n\n---\n\n{\n  \"parameter\": \"Energy Dependence\",\n  \"country\": \"United States\",\n  \"period\": \"Q4 2024\",\n  \"research_date\": \"2021-09-30\",\n  \"overview\": \"The United States has historically been a significant consumer of energy, with a diverse mix of domestic and imported sources. Energy dependence is a critical parameter for understanding the country's energy security and its implications for renewable energy investment. Lower energy import dependence is indicative of greater energy security and potentially more favorable conditions for the development of domestic renewable energy sources. As of my last update, the U.S. was making strides towards reducing its dependence on imported energy, primarily through increased production of natural gas, oil, and renewable energy sources.\",\n  \"current_status\": \"As of the last data point in 2021, the United States had seen a notable shift towards energy independence, largely due to the boom in domestic shale oil and gas production, as well as significant investments in renewable energy. The U.S. Energy Information Administration (EIA) reported a decrease in net energy imports, moving the country closer to a net exporter status. The growth in renewable energy capacity, including solar and wind, has also contributed to reducing the reliance on energy imports. However, the U.S. still imports certain types of energy, including crude oil from Canada and other countries.\",\n  \"historical_trends\": \"Over the past 3-5 years leading up to 2021, the United States experienced a significant transformation in its energy landscape. The surge in shale gas and oil production, facilitated by advancements in drilling technology, has been a major factor in reducing energy imports. Concurrently, there has been a steady increase in renewable energy capacity, supported by federal and state policies encouraging renewable energy development. These trends have contributed to a gradual decline in energy import dependency.\",\n  \"policy_framework\": \"The U.S. federal government, along with various state governments, has implemented a range of policies aimed at reducing energy dependence and promoting renewable energy. These include tax incentives for renewable energy projects, renewable portfolio standards (RPS) in many states, and federal emissions regulations encouraging cleaner energy sources. The Biden administration has also proposed ambitious climate and energy policies that could further accelerate the transition towards renewable energy and reduce dependence on imported energy.\",\n  \"key_metrics\": [\n    {\"metric\": \"Net Energy Imports\", \"value\": \"Data not available for 2024\", \"unit\": \"%\", \"source\": \"EIA\", \"date\": \"2021\"},\n    {\"metric\": \"Renewable Energy Capacity\", \"value\": \"Data not available for 2024\", \"unit\": \"GW\", \"source\": \"EIA\", \"date\": \"2021\"}\n  ],\n  \"challenges\": \"Despite progress, the United States faces several challenges in further reducing energy dependence. These include logistical and infrastructure limitations in integrating renewable energy into the national grid, regulatory hurdles, and the ongoing need for imported oil for transportation and industry. Additionally, geopolitical factors and global market dynamics continue to influence the U.S. energy import dependency.\",\n  \"opportunities\": \"The ongoing transition to renewable energy offers significant opportunities for reducing energy dependence. Continued technological advancements in renewable energy, battery storage, and energy efficiency, along with supportive policies, could further decrease the need for imported energy. Additionally, the growth of the electric vehicle market represents a potential reduction in oil imports for transportation.\",\n  \"future_outlook\": \"Looking ahead to the next 2-5 years, the United States is expected to continue its trajectory towards reduced energy dependence, driven by growth in renewable energy and advancements in energy technologies. Policy decisions and market developments will play crucial roles in shaping the future energy landscape. While specific data for Q4 2024 is not available, the trends suggest an ongoing decrease in energy import dependency, with renewable energy playing an increasingly significant role.\",\n  \"sources\": [\n    {\"name\": \"EIA\", \"url\": \"https://www.eia.gov/\", \"access_date\": \"2021-09-30\"},\n    {\"name\": \"BP Statistical Review of World Energy\", \"url\": \"http://www.bp.com/statisticalreview\", \"access_date\": \"2021-09-30\"}\n  ],\n  \"confidence\": 0.8,\n  \"completeness_score\": 0.7,\n  \"data_quality_notes\": \"The analysis is based on historical data and trends up to 2021. Future projections are speculative and should be updated with actual data when available.\"\n}\n\n---\n\nPlease note that the information above is based on historical data and trends available up to September 2021. For the most current analysis, especially for Q4 2024, you would need to access the latest data from the sources mentioned or other relevant databases.",
  "_validation": {
    "scores": {
      "completeness": 1.0,
      "data_quality": 0.3,
      "source_quality": 0.3,
      "overall": 0.58
    },
    "issues": [
      "Insufficient numerical data (< 3 metrics)",
      "Insufficient sources (< 3)"
    ],
    "passed": false,
    "grade": "F"
  }
}