{
  "parameter": "Support Scheme",
  "country": "Chile",
  "period": "Q4 2024",
  "research_date": "YYYY-MM-DD",
  "overview": "Chile has been a leader in the adoption and support of renewable energy within Latin America, leveraging its vast solar, wind, and hydroelectric resources. The support scheme for renewable energy in Chile is critical for attracting investment, driving technology adoption, and meeting the country's ambitious renewable energy targets. As of Q4 2024, the country's support mechanisms are expected to have evolved, reflecting global trends and the national commitment to sustainability and carbon neutrality.",
  "current_status": "As of the latest data available up to 2021, Chile had implemented a range of policies and support mechanisms, including auctions for renewable energy projects, net billing schemes for small-scale solar, and tax incentives for renewable energy investments. These mechanisms have been instrumental in the country's renewable energy boom, particularly in solar and wind sectors. By Q4 2024, these policies are anticipated to have been refined and possibly expanded, in line with Chile's increasing renewable energy targets and commitments to reduce carbon emissions.",
  "historical_trends": "Over the past 3-5 years leading up to 2021, Chile saw significant growth in its renewable energy sector, driven by supportive policies and global investment interest. The government's renewable energy auctions, initiated in the mid-2010s, have been particularly successful in attracting large-scale solar and wind projects. This period also saw the expansion of net billing schemes, allowing residential and commercial users to generate their own electricity and sell excess back to the grid.",
  "policy_framework": "Chile's renewable energy policy framework has historically been centered around its Renewable Energy Law, which set targets for renewable energy generation. The country has also participated in international agreements, committing to carbon neutrality by 2050. Specific numbers and dates, including targets for renewable energy capacity or carbon reduction, would need to be updated with the most recent commitments as of Q4 2024.",
  "key_metrics": [
    {
      "metric": "Renewable Energy Capacity",
      "value": "XX",
      "unit": "GW",
      "source": "National Energy Commission",
      "date": "2024"
    },
    {
      "metric": "Annual Investment in Renewable Energy",
      "value": "XX",
      "unit": "USD",
      "source": "BloombergNEF",
      "date": "2024"
    }
  ],
  "challenges": "Despite its successes, Chile's renewable energy sector faces challenges, including grid capacity and stability issues, regulatory hurdles, and the need for continued investment in technology and infrastructure. The integration of high levels of renewable energy into the national grid requires significant upgrades and investments in grid stability and storage solutions.",
  "opportunities": "Chile's abundant renewable resources, particularly in solar and wind, present significant opportunities for continued growth in the sector. The government's commitment to carbon neutrality and renewable energy targets provides a stable policy environment that is attractive to investors. Additionally, technological advancements and decreasing costs of renewable energy technologies offer the potential for increased efficiency and lower barriers to entry.",
  "future_outlook": "The outlook for Chile's renewable energy sector in Q4 2024 and beyond is positive, with expectations for continued growth, policy support, and investment. Specific projections for capacity growth, investment levels, and technological advancements would depend on global economic conditions, technological developments, and the country's policy environment.",
  "sources": [
    {
      "name": "National Energy Commission",
      "url": "URL",
      "access_date": "YYYY-MM-DD"
    },
    {
      "name": "BloombergNEF",
      "url": "URL",
      "access_date": "YYYY-MM-DD"
    }
  ],
  "confidence": 0.8,
  "completeness_score": 0.7,
  "data_quality_notes": "The analysis is based on historical data and trends up to 2021. Specific figures for Q4 2024 are hypothetical and should be updated with actual data when available.",
  "_metadata": {
    "research_date": "2026-01-13T00:31:14.408595",
    "execution_time_seconds": 22.931927,
    "parameter": "Support Scheme",
    "country": "Chile",
    "period": "Q4 2024",
    "llm_model": "gpt-4-turbo-preview",
    "prompt_length": 4116,
    "response_length": 4899
  },
  "_raw_response": "I'm sorry, but I can't provide real-time or future data, including predictions or analyses for Q4 2024, as my training data only goes up until September 2021. However, I can offer a general framework based on historical and existing knowledge up to 2021 that you might adapt or consider for constructing a hypothetical analysis on Chile's renewable energy support scheme as of Q4 2024. \n\n```json\n{\n  \"parameter\": \"Support Scheme\",\n  \"country\": \"Chile\",\n  \"period\": \"Q4 2024\",\n  \"research_date\": \"YYYY-MM-DD\",\n  \"overview\": \"Chile has been a leader in the adoption and support of renewable energy within Latin America, leveraging its vast solar, wind, and hydroelectric resources. The support scheme for renewable energy in Chile is critical for attracting investment, driving technology adoption, and meeting the country's ambitious renewable energy targets. As of Q4 2024, the country's support mechanisms are expected to have evolved, reflecting global trends and the national commitment to sustainability and carbon neutrality.\",\n  \"current_status\": \"As of the latest data available up to 2021, Chile had implemented a range of policies and support mechanisms, including auctions for renewable energy projects, net billing schemes for small-scale solar, and tax incentives for renewable energy investments. These mechanisms have been instrumental in the country's renewable energy boom, particularly in solar and wind sectors. By Q4 2024, these policies are anticipated to have been refined and possibly expanded, in line with Chile's increasing renewable energy targets and commitments to reduce carbon emissions.\",\n  \"historical_trends\": \"Over the past 3-5 years leading up to 2021, Chile saw significant growth in its renewable energy sector, driven by supportive policies and global investment interest. The government's renewable energy auctions, initiated in the mid-2010s, have been particularly successful in attracting large-scale solar and wind projects. This period also saw the expansion of net billing schemes, allowing residential and commercial users to generate their own electricity and sell excess back to the grid.\",\n  \"policy_framework\": \"Chile's renewable energy policy framework has historically been centered around its Renewable Energy Law, which set targets for renewable energy generation. The country has also participated in international agreements, committing to carbon neutrality by 2050. Specific numbers and dates, including targets for renewable energy capacity or carbon reduction, would need to be updated with the most recent commitments as of Q4 2024.\",\n  \"key_metrics\": [\n    {\"metric\": \"Renewable Energy Capacity\", \"value\": \"XX\", \"unit\": \"GW\", \"source\": \"National Energy Commission\", \"date\": \"2024\"},\n    {\"metric\": \"Annual Investment in Renewable Energy\", \"value\": \"XX\", \"unit\": \"USD\", \"source\": \"BloombergNEF\", \"date\": \"2024\"}\n  ],\n  \"challenges\": \"Despite its successes, Chile's renewable energy sector faces challenges, including grid capacity and stability issues, regulatory hurdles, and the need for continued investment in technology and infrastructure. The integration of high levels of renewable energy into the national grid requires significant upgrades and investments in grid stability and storage solutions.\",\n  \"opportunities\": \"Chile's abundant renewable resources, particularly in solar and wind, present significant opportunities for continued growth in the sector. The government's commitment to carbon neutrality and renewable energy targets provides a stable policy environment that is attractive to investors. Additionally, technological advancements and decreasing costs of renewable energy technologies offer the potential for increased efficiency and lower barriers to entry.\",\n  \"future_outlook\": \"The outlook for Chile's renewable energy sector in Q4 2024 and beyond is positive, with expectations for continued growth, policy support, and investment. Specific projections for capacity growth, investment levels, and technological advancements would depend on global economic conditions, technological developments, and the country's policy environment.\",\n  \"sources\": [\n    {\"name\": \"National Energy Commission\", \"url\": \"URL\", \"access_date\": \"YYYY-MM-DD\"},\n    {\"name\": \"BloombergNEF\", \"url\": \"URL\", \"access_date\": \"YYYY-MM-DD\"}\n  ],\n  \"confidence\": 0.8,\n  \"completeness_score\": 0.7,\n  \"data_quality_notes\": \"The analysis is based on historical data and trends up to 2021. Specific figures for Q4 2024 are hypothetical and should be updated with actual data when available.\"\n}\n```\n\nPlease note, the placeholders (e.g., \"XX\", \"URL\", \"YYYY-MM-DD\") should be replaced with actual data and sources as they become available. This template provides a structured approach to analyzing the support scheme for renewable energy in Chile but requires up-to-date information and analysis to reflect the current state in Q4 2024 accurately.",
  "_validation": {
    "scores": {
      "completeness": 1.0,
      "data_quality": 0.3,
      "source_quality": 0.3,
      "overall": 0.58
    },
    "issues": [
      "Insufficient numerical data (< 3 metrics)",
      "Insufficient sources (< 3)"
    ],
    "passed": false,
    "grade": "F"
  }
}