{
  "parameter": "Support Scheme",
  "country": "Australia",
  "period": "Q4 2024",
  "research_date": "2023-09-30",
  "overview": "As of the last update in 2023, Australia's support for renewable energy has been characterized by a mix of federal and state-level policies, including financial incentives, renewable energy targets, and regulatory measures designed to facilitate the growth of the sector. The importance of support schemes in Australia lies in the country's vast potential for renewable energy generation, including solar, wind, and hydroelectric power, and the need to transition away from fossil fuels to meet international climate commitments.",
  "current_status": "Historically, Australia's Renewable Energy Target (RET) has been a key federal policy driving renewable energy investment, supplemented by state-level initiatives such as feed-in tariffs (FiT), auctions for renewable energy projects, and direct funding for research and development. However, the effectiveness and alignment of these policies have varied, with some states advancing more aggressively towards renewables than others.",
  "historical_trends": "Over the past 3-5 years, there has been a significant increase in renewable energy capacity in Australia, driven by both large-scale projects and small-scale systems. The RET played a crucial role in this expansion until its target was effectively met in 2020. Since then, state-level policies and the emergence of corporate power purchase agreements (PPAs) have become more prominent drivers.",
  "policy_framework": "The policy framework for renewable energy in Australia includes the RET, state-level renewable energy targets, FiTs, and support for innovation through agencies such as the Australian Renewable Energy Agency (ARENA) and the Clean Energy Finance Corporation (CEFC). Recent policy announcements have focused on increasing the grid's capacity to handle renewable energy and supporting the development of energy storage solutions.",
  "key_metrics": [
    {
      "metric": "Renewable Energy Target (RET)",
      "value": "33,000",
      "unit": "GWh",
      "source": "Australian Government - Department of Industry, Science, Energy and Resources",
      "date": "2020"
    },
    {
      "metric": "Installed Renewable Capacity",
      "value": "N/A",
      "unit": "GW",
      "source": "N/A",
      "date": "2024"
    }
  ],
  "challenges": "Main challenges include grid integration of renewable energy, variability of renewable generation, and potential conflicts between federal and state policies. Additionally, the end of the RET's target period has created uncertainty about the future direction of federal support for renewables.",
  "opportunities": "Opportunities for growth in the renewable sector include the development of battery storage technology, ongoing state-level support, and the potential for new federal policies to further encourage renewable energy investment.",
  "future_outlook": "The future outlook for renewable energy support in Australia will likely involve a combination of continued state-level initiatives and the introduction of new federal policies designed to achieve net-zero emissions by 2050. Investment in grid infrastructure and energy storage will be critical to support this growth.",
  "sources": [
    {
      "name": "Australian Government - Department of Industry, Science, Energy and Resources",
      "url": "N/A",
      "access_date": "2023-09-30"
    },
    {
      "name": "Clean Energy Council Reports",
      "url": "N/A",
      "access_date": "2023-09-30"
    }
  ],
  "confidence": 0.8,
  "completeness_score": 0.7,
  "data_quality_notes": "This analysis is based on available data up to September 2023 and does not include specific future data or projections for Q4 2024.",
  "_metadata": {
    "research_date": "2026-01-13T00:30:50.963142",
    "execution_time_seconds": 27.954754,
    "parameter": "Support Scheme",
    "country": "Australia",
    "period": "Q4 2024",
    "llm_model": "gpt-4-turbo-preview",
    "prompt_length": 4124,
    "response_length": 4437
  },
  "_raw_response": "I'm sorry, but I can't provide real-time or future data, including projections for Q4 2024 or any specific data, numbers, or policy details that would be expected to occur after my last knowledge update in September 2023. However, I can offer a general framework based on historical and current trends up to 2023 that you might adapt or expand with future data as it becomes available. \n\n```json\n{\n  \"parameter\": \"Support Scheme\",\n  \"country\": \"Australia\",\n  \"period\": \"Q4 2024\",\n  \"research_date\": \"2023-09-30\",\n  \"overview\": \"As of the last update in 2023, Australia's support for renewable energy has been characterized by a mix of federal and state-level policies, including financial incentives, renewable energy targets, and regulatory measures designed to facilitate the growth of the sector. The importance of support schemes in Australia lies in the country's vast potential for renewable energy generation, including solar, wind, and hydroelectric power, and the need to transition away from fossil fuels to meet international climate commitments.\",\n  \"current_status\": \"Historically, Australia's Renewable Energy Target (RET) has been a key federal policy driving renewable energy investment, supplemented by state-level initiatives such as feed-in tariffs (FiT), auctions for renewable energy projects, and direct funding for research and development. However, the effectiveness and alignment of these policies have varied, with some states advancing more aggressively towards renewables than others.\",\n  \"historical_trends\": \"Over the past 3-5 years, there has been a significant increase in renewable energy capacity in Australia, driven by both large-scale projects and small-scale systems. The RET played a crucial role in this expansion until its target was effectively met in 2020. Since then, state-level policies and the emergence of corporate power purchase agreements (PPAs) have become more prominent drivers.\",\n  \"policy_framework\": \"The policy framework for renewable energy in Australia includes the RET, state-level renewable energy targets, FiTs, and support for innovation through agencies such as the Australian Renewable Energy Agency (ARENA) and the Clean Energy Finance Corporation (CEFC). Recent policy announcements have focused on increasing the grid's capacity to handle renewable energy and supporting the development of energy storage solutions.\",\n  \"key_metrics\": [\n    {\"metric\": \"Renewable Energy Target (RET)\", \"value\": \"33,000\", \"unit\": \"GWh\", \"source\": \"Australian Government - Department of Industry, Science, Energy and Resources\", \"date\": \"2020\"},\n    {\"metric\": \"Installed Renewable Capacity\", \"value\": \"N/A\", \"unit\": \"GW\", \"source\": \"N/A\", \"date\": \"2024\"}\n  ],\n  \"challenges\": \"Main challenges include grid integration of renewable energy, variability of renewable generation, and potential conflicts between federal and state policies. Additionally, the end of the RET's target period has created uncertainty about the future direction of federal support for renewables.\",\n  \"opportunities\": \"Opportunities for growth in the renewable sector include the development of battery storage technology, ongoing state-level support, and the potential for new federal policies to further encourage renewable energy investment.\",\n  \"future_outlook\": \"The future outlook for renewable energy support in Australia will likely involve a combination of continued state-level initiatives and the introduction of new federal policies designed to achieve net-zero emissions by 2050. Investment in grid infrastructure and energy storage will be critical to support this growth.\",\n  \"sources\": [\n    {\"name\": \"Australian Government - Department of Industry, Science, Energy and Resources\", \"url\": \"N/A\", \"access_date\": \"2023-09-30\"},\n    {\"name\": \"Clean Energy Council Reports\", \"url\": \"N/A\", \"access_date\": \"2023-09-30\"}\n  ],\n  \"confidence\": 0.8,\n  \"completeness_score\": 0.7,\n  \"data_quality_notes\": \"This analysis is based on available data up to September 2023 and does not include specific future data or projections for Q4 2024.\"\n}\n```\n\nPlease note that the JSON provided is a hypothetical framework based on information available up to 2023 and does not contain real-time data or projections for Q4 2024. For the most current and specific information, direct consultation of sources such as government reports, policy documents, and renewable energy market analyses from Q4 2024 would be necessary.",
  "_validation": {
    "scores": {
      "completeness": 1.0,
      "data_quality": 0.3,
      "source_quality": 0.3,
      "overall": 0.58
    },
    "issues": [
      "Insufficient numerical data (< 3 metrics)",
      "Insufficient sources (< 3)"
    ],
    "passed": false,
    "grade": "F"
  }
}