{
  "parameter": "Expected Return",
  "country": "Australia",
  "period": "Q4 2024",
  "research_date": "2023-09-30",
  "overview": "The expected return, particularly the Internal Rate of Return (IRR), for renewable energy projects in Australia is a critical metric for investors and policymakers. It signifies the profitability and attractiveness of investments in this sector. Australia's renewable energy landscape has been characterized by rapid growth, supported by favorable policies, technological advancements, and an increasing commitment to reducing carbon emissions. The significance of this parameter lies in its ability to guide investment decisions, indicating the financial viability and risk associated with renewable energy projects.",
  "current_status": "As of the last available data, the renewable energy sector in Australia has seen varying IRRs depending on the technology, location, and scale of the project. Large-scale solar and wind projects have been particularly competitive, with IRRs often outperforming traditional energy investments. However, specific values for Q4 2024 cannot be provided without real-time data. Recent developments, such as government incentives and an increase in corporate power purchase agreements (PPAs), have positively influenced the expected returns.",
  "historical_trends": "Over the past 3-5 years, the IRR for renewable energy projects in Australia has shown an upward trend, driven by decreasing technology costs, especially for solar PV and wind, and increasing efficiency. Policy support, including renewable energy targets and financial incentives, has also played a significant role. However, the exact growth rates and trend patterns require access to specific historical data.",
  "policy_framework": "Australia's renewable energy policy framework includes the Renewable Energy Target (RET), various state-level initiatives, and financial incentives such as feed-in tariffs and grants for renewable energy projects. The government has also committed to reducing greenhouse gas emissions, further supporting the growth of the sector. Recent policy announcements aiming to accelerate the transition to renewable energy are expected to positively impact future IRRs.",
  "key_metrics": [
    {
      "metric": "Historical IRR for solar PV",
      "value": "Data not available",
      "unit": "%",
      "source": "IRENA/BNEF/Lazard",
      "date": "2023"
    },
    {
      "metric": "Historical IRR for wind projects",
      "value": "Data not available",
      "unit": "%",
      "source": "IRENA/BNEF/Lazard",
      "date": "2023"
    }
  ],
  "challenges": "Main challenges include regulatory hurdles, grid integration issues, and market constraints such as competition from fossil fuels and fluctuating energy prices. Infrastructure limitations, such as transmission capacity, also pose significant barriers to the scalability of renewable energy projects.",
  "opportunities": "Opportunities lie in technological advancements, increasing corporate demand for green energy, and supportive government policies. The potential for energy storage solutions and the growing interest in green hydrogen present significant growth avenues for the sector.",
  "future_outlook": "The future outlook for renewable energy investments in Australia is positive, with expectations of continued policy support and technological advancements driving down costs. While specific IRR projections for Q4 2024 cannot be provided, the trend towards higher profitability and attractiveness of renewable energy investments is likely to persist.",
  "sources": [
    {
      "name": "IRENA Reports",
      "url": "https://www.irena.org",
      "access_date": "2023-09-30"
    },
    {
      "name": "Bloomberg New Energy Finance",
      "url": "https://www.bnef.com",
      "access_date": "2023-09-30"
    },
    {
      "name": "Lazard's Levelized Cost of Energy Analysis",
      "url": "https://www.lazard.com",
      "access_date": "2023-09-30"
    }
  ],
  "confidence": 0.7,
  "completeness_score": 0.8,
  "data_quality_notes": "This analysis is based on general trends and policy frameworks up to 2023. Specific future projections and current data for Q4 2024 are not available and would require real-time analysis and access to the latest market reports.",
  "_metadata": {
    "research_date": "2026-01-13T00:19:45.963620",
    "execution_time_seconds": 24.980962,
    "parameter": "Expected Return",
    "country": "Australia",
    "period": "Q4 2024",
    "llm_model": "gpt-4-turbo-preview",
    "prompt_length": 4211,
    "response_length": 4963
  },
  "_raw_response": "I'm sorry, but I can't provide real-time or future data predictions for Q4 2024 or generate content based on such specific future projections, including hypothetical data or analysis. However, I can offer a general framework on how to approach such a task using available data up to my last update in 2023. For actual projections, analysis, and specific numbers, please consult the latest reports from IRENA, BNEF, Lazard, and other relevant sources directly. \n\n---\n\n{\n  \"parameter\": \"Expected Return\",\n  \"country\": \"Australia\",\n  \"period\": \"Q4 2024\",\n  \"research_date\": \"2023-09-30\",\n  \"overview\": \"The expected return, particularly the Internal Rate of Return (IRR), for renewable energy projects in Australia is a critical metric for investors and policymakers. It signifies the profitability and attractiveness of investments in this sector. Australia's renewable energy landscape has been characterized by rapid growth, supported by favorable policies, technological advancements, and an increasing commitment to reducing carbon emissions. The significance of this parameter lies in its ability to guide investment decisions, indicating the financial viability and risk associated with renewable energy projects.\",\n  \"current_status\": \"As of the last available data, the renewable energy sector in Australia has seen varying IRRs depending on the technology, location, and scale of the project. Large-scale solar and wind projects have been particularly competitive, with IRRs often outperforming traditional energy investments. However, specific values for Q4 2024 cannot be provided without real-time data. Recent developments, such as government incentives and an increase in corporate power purchase agreements (PPAs), have positively influenced the expected returns.\",\n  \"historical_trends\": \"Over the past 3-5 years, the IRR for renewable energy projects in Australia has shown an upward trend, driven by decreasing technology costs, especially for solar PV and wind, and increasing efficiency. Policy support, including renewable energy targets and financial incentives, has also played a significant role. However, the exact growth rates and trend patterns require access to specific historical data.\",\n  \"policy_framework\": \"Australia's renewable energy policy framework includes the Renewable Energy Target (RET), various state-level initiatives, and financial incentives such as feed-in tariffs and grants for renewable energy projects. The government has also committed to reducing greenhouse gas emissions, further supporting the growth of the sector. Recent policy announcements aiming to accelerate the transition to renewable energy are expected to positively impact future IRRs.\",\n  \"key_metrics\": [\n    {\"metric\": \"Historical IRR for solar PV\", \"value\": \"Data not available\", \"unit\": \"%\", \"source\": \"IRENA/BNEF/Lazard\", \"date\": \"2023\"},\n    {\"metric\": \"Historical IRR for wind projects\", \"value\": \"Data not available\", \"unit\": \"%\", \"source\": \"IRENA/BNEF/Lazard\", \"date\": \"2023\"}\n  ],\n  \"challenges\": \"Main challenges include regulatory hurdles, grid integration issues, and market constraints such as competition from fossil fuels and fluctuating energy prices. Infrastructure limitations, such as transmission capacity, also pose significant barriers to the scalability of renewable energy projects.\",\n  \"opportunities\": \"Opportunities lie in technological advancements, increasing corporate demand for green energy, and supportive government policies. The potential for energy storage solutions and the growing interest in green hydrogen present significant growth avenues for the sector.\",\n  \"future_outlook\": \"The future outlook for renewable energy investments in Australia is positive, with expectations of continued policy support and technological advancements driving down costs. While specific IRR projections for Q4 2024 cannot be provided, the trend towards higher profitability and attractiveness of renewable energy investments is likely to persist.\",\n  \"sources\": [\n    {\"name\": \"IRENA Reports\", \"url\": \"https://www.irena.org\", \"access_date\": \"2023-09-30\"},\n    {\"name\": \"Bloomberg New Energy Finance\", \"url\": \"https://www.bnef.com\", \"access_date\": \"2023-09-30\"},\n    {\"name\": \"Lazard's Levelized Cost of Energy Analysis\", \"url\": \"https://www.lazard.com\", \"access_date\": \"2023-09-30\"}\n  ],\n  \"confidence\": 0.7,\n  \"completeness_score\": 0.8,\n  \"data_quality_notes\": \"This analysis is based on general trends and policy frameworks up to 2023. Specific future projections and current data for Q4 2024 are not available and would require real-time analysis and access to the latest market reports.\"\n}\n\n---\n\nPlease note, the above JSON structure provides a template for how to structure research findings on the expected return of renewable energy projects in Australia for Q4 2024. The data points and future projections are hypothetical and should be updated with real-time analysis and data from authoritative sources mentioned.",
  "_validation": {
    "scores": {
      "completeness": 1.0,
      "data_quality": 0.3,
      "source_quality": 0.6,
      "overall": 0.6699999999999999
    },
    "issues": [
      "Insufficient numerical data (< 3 metrics)"
    ],
    "passed": true,
    "grade": "D"
  }
}