{
  "parameter": "Status of Grid",
  "country": "United States",
  "period": "Q4 2024",
  "research_date": "YYYY-MM-DD",
  "overview": "The grid infrastructure in the United States as of Q4 2024 plays a pivotal role in the integration and deployment of renewable energy sources. High-quality grid infrastructure not only ensures the reliable transmission of electricity but also minimizes the risk of renewable energy curtailment. The current state of the grid reflects significant investments in modernization and capacity expansion, aimed at accommodating the growing share of renewables in the energy mix.",
  "current_status": "As of the last quarter of 2024, the United States has seen substantial improvements in grid infrastructure quality, transmission capacity, and reliability. Key metrics such as SAIDI and SAIFI have shown notable improvements, indicating fewer and shorter power outages. Recent developments include the completion of several high-capacity transmission lines designed specifically for renewable energy sources, significantly reducing congestion and facilitating smoother power flow across regions.",
  "historical_trends": "Over the past 3-5 years, the United States has embarked on an ambitious plan to upgrade its grid infrastructure. This includes the adoption of smart grid technologies, increased investment in transmission lines, and the implementation of policies aimed at enhancing grid resilience against natural disasters and cyber-attacks. These efforts have resulted in a steady improvement in grid reliability and capacity, laying a solid foundation for the integration of renewable energy.",
  "policy_framework": "The policy landscape surrounding grid infrastructure in the United States has evolved rapidly, with several key pieces of legislation and regulatory initiatives paving the way for modernization. The Renewable Energy Grid Integration Act (REGIA), passed in 2023, provided significant federal funding and incentives for grid upgrades. Additionally, the Clean Energy Transmission Initiative (CETI) established guidelines and support for interstate transmission projects, facilitating the national distribution of renewable energy.",
  "key_metrics": [
    {
      "metric": "SAIDI",
      "value": "50",
      "unit": "minutes/year",
      "source": "National Grid Reliability Report",
      "date": "2024-01-01"
    },
    {
      "metric": "SAIFI",
      "value": "0.5",
      "unit": "interruptions/customer/year",
      "source": "National Grid Reliability Report",
      "date": "2024-01-01"
    },
    {
      "metric": "Transmission Capacity",
      "value": "150",
      "unit": "GW",
      "source": "Renewable Energy Transmission Association",
      "date": "2024-01-01"
    }
  ],
  "challenges": "Despite significant progress, challenges remain in fully optimizing the grid for renewable energy integration. Regulatory hurdles, particularly at the state level, continue to impede the rapid deployment of new transmission projects. Additionally, the physical and cyber security of the grid infrastructure remains a concern, with ongoing efforts required to safeguard against threats.",
  "opportunities": "The ongoing modernization of the grid presents numerous opportunities for further enhancing renewable energy integration. The expansion of smart grid technologies, such as advanced metering infrastructure and grid automation, offers potential for more efficient and reliable grid operation. Furthermore, the growing trend of decentralized energy production, including residential solar and community energy storage, could significantly alter the energy landscape, reducing reliance on traditional transmission infrastructure.",
  "future_outlook": "Looking ahead to the next 2-5 years, the United States is poised to continue its trajectory towards a more resilient and renewable-friendly grid. Legislative and regulatory support is expected to remain strong, with further investments anticipated in both grid modernization and renewable energy projects. This, coupled with technological advancements in energy storage and management, suggests a promising future for renewable energy integration.",
  "sources": [
    {
      "name": "National Grid Reliability Report",
      "url": "http://example.com/gridreliability",
      "access_date": "2024-01-01"
    },
    {
      "name": "Renewable Energy Transmission Association",
      "url": "http://example.com/renewabletransmission",
      "access_date": "2024-01-01"
    }
  ],
  "confidence": 0.8,
  "completeness_score": 0.9,
  "data_quality_notes": "The data presented is based on the most recent reports and projections available as of the research date. However, actual values may vary due to ongoing developments in grid technology and renewable energy policy.",
  "_metadata": {
    "research_date": "2026-01-13T00:35:49.455878",
    "execution_time_seconds": 24.2639,
    "parameter": "Status of Grid",
    "country": "United States",
    "period": "Q4 2024",
    "llm_model": "gpt-4-turbo-preview",
    "prompt_length": 4551,
    "response_length": 5214
  },
  "_raw_response": "I'm sorry, but I can't provide real-time or future data, including predictions for Q4 2024. However, I can offer a general template based on how to approach such a task with hypothetical or illustrative data, which you can then adapt or fill in with up-to-date information when conducting your research. Here's how you might structure your document:\n\n```json\n{\n  \"parameter\": \"Status of Grid\",\n  \"country\": \"United States\",\n  \"period\": \"Q4 2024\",\n  \"research_date\": \"YYYY-MM-DD\",\n  \"overview\": \"The grid infrastructure in the United States as of Q4 2024 plays a pivotal role in the integration and deployment of renewable energy sources. High-quality grid infrastructure not only ensures the reliable transmission of electricity but also minimizes the risk of renewable energy curtailment. The current state of the grid reflects significant investments in modernization and capacity expansion, aimed at accommodating the growing share of renewables in the energy mix.\",\n  \"current_status\": \"As of the last quarter of 2024, the United States has seen substantial improvements in grid infrastructure quality, transmission capacity, and reliability. Key metrics such as SAIDI and SAIFI have shown notable improvements, indicating fewer and shorter power outages. Recent developments include the completion of several high-capacity transmission lines designed specifically for renewable energy sources, significantly reducing congestion and facilitating smoother power flow across regions.\",\n  \"historical_trends\": \"Over the past 3-5 years, the United States has embarked on an ambitious plan to upgrade its grid infrastructure. This includes the adoption of smart grid technologies, increased investment in transmission lines, and the implementation of policies aimed at enhancing grid resilience against natural disasters and cyber-attacks. These efforts have resulted in a steady improvement in grid reliability and capacity, laying a solid foundation for the integration of renewable energy.\",\n  \"policy_framework\": \"The policy landscape surrounding grid infrastructure in the United States has evolved rapidly, with several key pieces of legislation and regulatory initiatives paving the way for modernization. The Renewable Energy Grid Integration Act (REGIA), passed in 2023, provided significant federal funding and incentives for grid upgrades. Additionally, the Clean Energy Transmission Initiative (CETI) established guidelines and support for interstate transmission projects, facilitating the national distribution of renewable energy.\",\n  \"key_metrics\": [\n    {\"metric\": \"SAIDI\", \"value\": \"50\", \"unit\": \"minutes/year\", \"source\": \"National Grid Reliability Report\", \"date\": \"2024-01-01\"},\n    {\"metric\": \"SAIFI\", \"value\": \"0.5\", \"unit\": \"interruptions/customer/year\", \"source\": \"National Grid Reliability Report\", \"date\": \"2024-01-01\"},\n    {\"metric\": \"Transmission Capacity\", \"value\": \"150\", \"unit\": \"GW\", \"source\": \"Renewable Energy Transmission Association\", \"date\": \"2024-01-01\"}\n  ],\n  \"challenges\": \"Despite significant progress, challenges remain in fully optimizing the grid for renewable energy integration. Regulatory hurdles, particularly at the state level, continue to impede the rapid deployment of new transmission projects. Additionally, the physical and cyber security of the grid infrastructure remains a concern, with ongoing efforts required to safeguard against threats.\",\n  \"opportunities\": \"The ongoing modernization of the grid presents numerous opportunities for further enhancing renewable energy integration. The expansion of smart grid technologies, such as advanced metering infrastructure and grid automation, offers potential for more efficient and reliable grid operation. Furthermore, the growing trend of decentralized energy production, including residential solar and community energy storage, could significantly alter the energy landscape, reducing reliance on traditional transmission infrastructure.\",\n  \"future_outlook\": \"Looking ahead to the next 2-5 years, the United States is poised to continue its trajectory towards a more resilient and renewable-friendly grid. Legislative and regulatory support is expected to remain strong, with further investments anticipated in both grid modernization and renewable energy projects. This, coupled with technological advancements in energy storage and management, suggests a promising future for renewable energy integration.\",\n  \"sources\": [\n    {\"name\": \"National Grid Reliability Report\", \"url\": \"http://example.com/gridreliability\", \"access_date\": \"2024-01-01\"},\n    {\"name\": \"Renewable Energy Transmission Association\", \"url\": \"http://example.com/renewabletransmission\", \"access_date\": \"2024-01-01\"}\n  ],\n  \"confidence\": 0.8,\n  \"completeness_score\": 0.9,\n  \"data_quality_notes\": \"The data presented is based on the most recent reports and projections available as of the research date. However, actual values may vary due to ongoing developments in grid technology and renewable energy policy.\"\n}\n```\n\nRemember, this template uses hypothetical data and should be populated with real, up-to-date information when conducting actual research. Always verify the latest data and sources to ensure accuracy and relevance.",
  "_validation": {
    "scores": {
      "completeness": 1.0,
      "data_quality": 0.6,
      "source_quality": 0.3,
      "overall": 0.67
    },
    "issues": [
      "Insufficient sources (< 3)"
    ],
    "passed": true,
    "grade": "D"
  }
}