{
  "parameter": "Ownership Consolidation",
  "country": "India",
  "period": "Q4 2024",
  "research_date": "2023-09-30",
  "overview": "In India, the renewable energy sector has seen significant growth, driven by favorable government policies and increasing investment. Ownership consolidation is a critical parameter for understanding market dynamics and investment opportunities. As of Q4 2024, the market shows signs of moderate consolidation, reflecting a competitive landscape with diverse ownership. This parameter is crucial for investors as it impacts market entry strategies, competitive dynamics, and risk assessment.",
  "current_status": "As of Q4 2024, the top three renewable energy asset owners in India control approximately 45% of the market, indicating moderate consolidation. This landscape has evolved due to the government's push for renewable energy, attracting both domestic and international investors. Recent developments, such as the introduction of competitive bidding and tariff caps, have further influenced market dynamics, encouraging a more diverse ownership structure.",
  "historical_trends": "Over the past 3-5 years, the renewable energy market in India has transitioned from high to moderate consolidation. Key policy changes, including the Solar Energy Corporation of India's (SECI) role in auctioning large-scale projects, have played a significant role in this shift. The market share of the top three owners has decreased from 55% in 2019 to 45% in 2024, reflecting increased competition and entry of new players.",
  "policy_framework": "The Indian government has implemented several policies to support renewable energy growth, including the National Solar Mission and the Wind Energy Program. Specific targets, such as achieving 175 GW of renewable energy capacity by 2022, have been instrumental in driving investment. Recent policy announcements, such as the Production Linked Incentive (PLI) scheme for solar modules, aim to further boost domestic manufacturing and reduce import dependence.",
  "key_metrics": [
    {
      "metric": "Market share of top 3 owners",
      "value": "45",
      "unit": "%",
      "source": "Industry Reports",
      "date": "2024-12-31"
    },
    {
      "metric": "Renewable energy capacity target",
      "value": "175",
      "unit": "GW",
      "source": "Government of India",
      "date": "2022-12-31"
    }
  ],
  "challenges": "Despite favorable policies, the renewable energy sector in India faces challenges such as land acquisition difficulties, grid integration of renewable sources, and financial health of distribution companies. Regulatory hurdles and policy uncertainty also pose risks to market participants.",
  "opportunities": "India's renewable energy sector offers significant opportunities, driven by supportive government policies, increasing energy demand, and the global shift towards clean energy. The market's moderate consolidation level presents entry opportunities for new investors, while initiatives like the PLI scheme offer incentives for domestic manufacturing.",
  "future_outlook": "The next 2-5 years are expected to see continued growth in India's renewable energy sector, with increased investment and capacity addition. Policy measures aimed at addressing current challenges and promoting domestic manufacturing are likely to shape market dynamics, potentially leading to further diversification of ownership.",
  "sources": [
    {
      "name": "Industry Reports",
      "url": "http://example.com/industry-reports",
      "access_date": "2023-09-30"
    },
    {
      "name": "Government of India",
      "url": "http://example.com/government-policies",
      "access_date": "2023-09-30"
    }
  ],
  "confidence": 0.8,
  "completeness_score": 0.9,
  "data_quality_notes": "The analysis is based on available industry reports and government announcements as of September 2023. Actual market developments could differ, impacting the accuracy of future-oriented statements.",
  "_metadata": {
    "research_date": "2026-01-13T00:42:45.204321",
    "execution_time_seconds": 21.402637,
    "parameter": "Ownership Consolidation",
    "country": "India",
    "period": "Q4 2024",
    "llm_model": "gpt-4-turbo-preview",
    "prompt_length": 4430,
    "response_length": 4545
  },
  "_raw_response": "I'm sorry, but I can't provide real-time or future data, including predictions for Q4 2024 or any specific future dates, as my last training data is from September 2021. However, I can offer a hypothetical example based on the structure and requirements you've provided. This example will not contain real future data or predictions but will illustrate how to structure your research document according to your instructions.\n\n```json\n{\n  \"parameter\": \"Ownership Consolidation\",\n  \"country\": \"India\",\n  \"period\": \"Q4 2024\",\n  \"research_date\": \"2023-09-30\",\n  \"overview\": \"In India, the renewable energy sector has seen significant growth, driven by favorable government policies and increasing investment. Ownership consolidation is a critical parameter for understanding market dynamics and investment opportunities. As of Q4 2024, the market shows signs of moderate consolidation, reflecting a competitive landscape with diverse ownership. This parameter is crucial for investors as it impacts market entry strategies, competitive dynamics, and risk assessment.\",\n  \"current_status\": \"As of Q4 2024, the top three renewable energy asset owners in India control approximately 45% of the market, indicating moderate consolidation. This landscape has evolved due to the government's push for renewable energy, attracting both domestic and international investors. Recent developments, such as the introduction of competitive bidding and tariff caps, have further influenced market dynamics, encouraging a more diverse ownership structure.\",\n  \"historical_trends\": \"Over the past 3-5 years, the renewable energy market in India has transitioned from high to moderate consolidation. Key policy changes, including the Solar Energy Corporation of India's (SECI) role in auctioning large-scale projects, have played a significant role in this shift. The market share of the top three owners has decreased from 55% in 2019 to 45% in 2024, reflecting increased competition and entry of new players.\",\n  \"policy_framework\": \"The Indian government has implemented several policies to support renewable energy growth, including the National Solar Mission and the Wind Energy Program. Specific targets, such as achieving 175 GW of renewable energy capacity by 2022, have been instrumental in driving investment. Recent policy announcements, such as the Production Linked Incentive (PLI) scheme for solar modules, aim to further boost domestic manufacturing and reduce import dependence.\",\n  \"key_metrics\": [\n    {\"metric\": \"Market share of top 3 owners\", \"value\": \"45\", \"unit\": \"%\", \"source\": \"Industry Reports\", \"date\": \"2024-12-31\"},\n    {\"metric\": \"Renewable energy capacity target\", \"value\": \"175\", \"unit\": \"GW\", \"source\": \"Government of India\", \"date\": \"2022-12-31\"}\n  ],\n  \"challenges\": \"Despite favorable policies, the renewable energy sector in India faces challenges such as land acquisition difficulties, grid integration of renewable sources, and financial health of distribution companies. Regulatory hurdles and policy uncertainty also pose risks to market participants.\",\n  \"opportunities\": \"India's renewable energy sector offers significant opportunities, driven by supportive government policies, increasing energy demand, and the global shift towards clean energy. The market's moderate consolidation level presents entry opportunities for new investors, while initiatives like the PLI scheme offer incentives for domestic manufacturing.\",\n  \"future_outlook\": \"The next 2-5 years are expected to see continued growth in India's renewable energy sector, with increased investment and capacity addition. Policy measures aimed at addressing current challenges and promoting domestic manufacturing are likely to shape market dynamics, potentially leading to further diversification of ownership.\",\n  \"sources\": [\n    {\"name\": \"Industry Reports\", \"url\": \"http://example.com/industry-reports\", \"access_date\": \"2023-09-30\"},\n    {\"name\": \"Government of India\", \"url\": \"http://example.com/government-policies\", \"access_date\": \"2023-09-30\"}\n  ],\n  \"confidence\": 0.8,\n  \"completeness_score\": 0.9,\n  \"data_quality_notes\": \"The analysis is based on available industry reports and government announcements as of September 2023. Actual market developments could differ, impacting the accuracy of future-oriented statements.\"\n}\n```\n\nPlease note, the above example is entirely hypothetical and illustrates how to structure a research document based on the given instructions. Actual research should be based on real data and analysis from credible sources.",
  "_validation": {
    "scores": {
      "completeness": 1.0,
      "data_quality": 0.3,
      "source_quality": 0.3,
      "overall": 0.58
    },
    "issues": [
      "Insufficient numerical data (< 3 metrics)",
      "Insufficient sources (< 3)"
    ],
    "passed": false,
    "grade": "F"
  }
}