{
  "parameter": "Ownership Hurdles",
  "country": "Brazil",
  "period": "Q4 2024",
  "research_date": "YYYY-MM-DD",
  "overview": "As of the last update in 2021, Brazil has been working towards creating a more favorable environment for foreign investment in the renewable energy sector. Ownership hurdles have historically been a significant concern for international investors looking to enter the Brazilian market. These barriers include regulatory restrictions, complex approval processes, and a need for local partnerships. Understanding these hurdles is crucial for investors considering Brazil's renewable energy sector, as they directly impact market access and the potential return on investment.",
  "current_status": "By the end of 2021, Brazil had started to implement reforms aimed at reducing ownership hurdles for foreign investors in the renewable energy sector. However, specific details on the current state as of Q4 2024 would require access to the latest data from sources such as the OECD FDI Regulatory Restrictiveness Index, World Bank Doing Business reports, and national energy laws. Comparatively, Brazil's efforts to attract foreign investment have been in line with regional trends, focusing on liberalizing the market and simplifying the investment process.",
  "historical_trends": "Over the past 3-5 years leading up to 2021, Brazil has shown a trend towards liberalization in its energy sector, including renewable energy. Key policy changes have aimed at making the market more accessible to foreign investors. These changes have been part of Brazil's broader strategy to diversify its energy matrix and increase the share of renewable energy sources.",
  "policy_framework": "The Brazilian government has implemented several policies aimed at encouraging renewable energy investment. These include tax incentives, simplified approval processes for foreign investors, and initiatives designed to increase transparency and reduce bureaucratic obstacles. However, specific numbers and dates would require consultation of the most recent policy documents and legal texts.",
  "key_metrics": [
    {
      "metric": "Example metric",
      "value": "Example value",
      "unit": "Example unit",
      "source": "Example source",
      "date": "Example date"
    }
  ],
  "challenges": "Despite efforts to improve the investment climate, Brazil still faces challenges related to ownership hurdles. These include bureaucratic red tape, complex regulatory frameworks, and the need for local partnerships, which can deter foreign investment. Additionally, infrastructure limitations and logistical challenges in remote areas can further complicate market entry for foreign investors.",
  "opportunities": "Brazil presents significant opportunities in the renewable energy sector, thanks to its abundant natural resources, including wind, solar, and biomass. The government's commitment to increasing the share of renewable energy in the country's energy matrix and ongoing reforms to reduce ownership hurdles create a favorable environment for foreign investment.",
  "future_outlook": "Looking ahead to the next 2-5 years, Brazil is expected to continue its efforts to attract foreign investment in the renewable energy sector. This may include further reforms to reduce ownership hurdles and enhance market accessibility. However, specific projections would depend on the continuation of current policies and the global economic climate.",
  "sources": [
    {
      "name": "Example source",
      "url": "Example URL",
      "access_date": "Example access date"
    }
  ],
  "confidence": 0.0,
  "completeness_score": 0.0,
  "data_quality_notes": "This template is based on historical data and trends up to 2021. For the most current information, please refer to the latest reports and data from relevant sources.",
  "_metadata": {
    "research_date": "2026-01-13T00:38:25.211330",
    "execution_time_seconds": 27.413235,
    "parameter": "Ownership Hurdles",
    "country": "Brazil",
    "period": "Q4 2024",
    "llm_model": "gpt-4-turbo-preview",
    "prompt_length": 4501,
    "response_length": 4380
  },
  "_raw_response": "I'm sorry, but I can't provide real-time or future data predictions for Q4 2024 or create content based on specific future dates, as my training only includes information up to September 2021. However, I can offer a general template based on historical data and trends up to my last update. For accurate and up-to-date information, please consult the latest reports from relevant sources like the OECD, World Bank, and official Brazilian government publications.\n\n```json\n{\n  \"parameter\": \"Ownership Hurdles\",\n  \"country\": \"Brazil\",\n  \"period\": \"Q4 2024\",\n  \"research_date\": \"YYYY-MM-DD\",\n  \"overview\": \"As of the last update in 2021, Brazil has been working towards creating a more favorable environment for foreign investment in the renewable energy sector. Ownership hurdles have historically been a significant concern for international investors looking to enter the Brazilian market. These barriers include regulatory restrictions, complex approval processes, and a need for local partnerships. Understanding these hurdles is crucial for investors considering Brazil's renewable energy sector, as they directly impact market access and the potential return on investment.\",\n  \"current_status\": \"By the end of 2021, Brazil had started to implement reforms aimed at reducing ownership hurdles for foreign investors in the renewable energy sector. However, specific details on the current state as of Q4 2024 would require access to the latest data from sources such as the OECD FDI Regulatory Restrictiveness Index, World Bank Doing Business reports, and national energy laws. Comparatively, Brazil's efforts to attract foreign investment have been in line with regional trends, focusing on liberalizing the market and simplifying the investment process.\",\n  \"historical_trends\": \"Over the past 3-5 years leading up to 2021, Brazil has shown a trend towards liberalization in its energy sector, including renewable energy. Key policy changes have aimed at making the market more accessible to foreign investors. These changes have been part of Brazil's broader strategy to diversify its energy matrix and increase the share of renewable energy sources.\",\n  \"policy_framework\": \"The Brazilian government has implemented several policies aimed at encouraging renewable energy investment. These include tax incentives, simplified approval processes for foreign investors, and initiatives designed to increase transparency and reduce bureaucratic obstacles. However, specific numbers and dates would require consultation of the most recent policy documents and legal texts.\",\n  \"key_metrics\": [\n    {\"metric\": \"Example metric\", \"value\": \"Example value\", \"unit\": \"Example unit\", \"source\": \"Example source\", \"date\": \"Example date\"}\n  ],\n  \"challenges\": \"Despite efforts to improve the investment climate, Brazil still faces challenges related to ownership hurdles. These include bureaucratic red tape, complex regulatory frameworks, and the need for local partnerships, which can deter foreign investment. Additionally, infrastructure limitations and logistical challenges in remote areas can further complicate market entry for foreign investors.\",\n  \"opportunities\": \"Brazil presents significant opportunities in the renewable energy sector, thanks to its abundant natural resources, including wind, solar, and biomass. The government's commitment to increasing the share of renewable energy in the country's energy matrix and ongoing reforms to reduce ownership hurdles create a favorable environment for foreign investment.\",\n  \"future_outlook\": \"Looking ahead to the next 2-5 years, Brazil is expected to continue its efforts to attract foreign investment in the renewable energy sector. This may include further reforms to reduce ownership hurdles and enhance market accessibility. However, specific projections would depend on the continuation of current policies and the global economic climate.\",\n  \"sources\": [\n    {\"name\": \"Example source\", \"url\": \"Example URL\", \"access_date\": \"Example access date\"}\n  ],\n  \"confidence\": 0.0,\n  \"completeness_score\": 0.0,\n  \"data_quality_notes\": \"This template is based on historical data and trends up to 2021. For the most current information, please refer to the latest reports and data from relevant sources.\"\n}\n```\n\nPlease replace the placeholders with up-to-date information from the specified sources for a comprehensive analysis.",
  "_validation": {
    "scores": {
      "completeness": 1.0,
      "data_quality": 0.3,
      "source_quality": 0.3,
      "overall": 0.58
    },
    "issues": [
      "Insufficient numerical data (< 3 metrics)",
      "Insufficient sources (< 3)"
    ],
    "passed": false,
    "grade": "F"
  }
}