{
  "parameter": "Ownership Hurdles",
  "country": "Chile",
  "period": "Q4 2024",
  "research_date": "2023-09-30",
  "overview": "As of Q4 2024, Chile has continued to position itself as a leader in renewable energy within Latin America, largely due to its favorable regulatory environment and commitment to reducing ownership hurdles for foreign investors in the renewable energy sector. Ownership hurdles are critical for renewable energy investment as they directly impact the ease with which foreign entities can enter and operate within the market. In Chile, recent reforms have aimed at further lowering these barriers, thereby enhancing the country's attractiveness to international investors and developers.",
  "current_status": "By the end of 2024, Chile has made significant strides in reducing regulatory and practical barriers to foreign ownership in the renewable energy sector. The OECD FDI Regulatory Restrictiveness Index for Chile shows an improvement, with the country now scoring better than the regional average. Specific measures include simplifying the process for obtaining necessary permits and licenses for renewable energy projects and increasing the cap on foreign ownership from 80% to 95% in certain energy sub-sectors. These changes have resulted in a noticeable uptick in foreign direct investment in renewable energy, with an increase of 20% compared to the previous year.",
  "historical_trends": "Over the past five years, Chile has progressively amended its national energy laws and regulations to facilitate greater foreign participation. Notably, in 2021, the government launched a comprehensive review of its energy policy framework, identifying ownership hurdles as a key area for reform. Subsequent policy changes have focused on streamlining administrative procedures and enhancing legal certainty for foreign investors. This has seen Chile's score on the OECD FDI Regulatory Restrictiveness Index improve from 0.25 in 2020 to 0.15 in 2024.",
  "policy_framework": "The Chilean government's commitment to renewable energy is enshrined in its National Renewable Energy Policy, which targets achieving 70% of its energy from renewable sources by 2030. Key legislation facilitating foreign ownership includes the 2023 Renewable Energy Investment Act, which introduced measures such as tax incentives for foreign-owned renewable energy projects and reduced restrictions on land acquisition for such projects. The Act also established a one-stop shop for renewable energy permits to streamline the approval process.",
  "key_metrics": [
    {
      "metric": "OECD FDI Regulatory Restrictiveness Index Score",
      "value": "0.15",
      "unit": "Index",
      "source": "OECD",
      "date": "2024-01-01"
    },
    {
      "metric": "Increase in Foreign Direct Investment in Renewable Energy",
      "value": "20",
      "unit": "%",
      "source": "National Renewable Energy Agency",
      "date": "2024-12-31"
    },
    {
      "metric": "Renewable Energy Target",
      "value": "70",
      "unit": "%",
      "source": "National Renewable Energy Policy",
      "date": "2030-12-31"
    }
  ],
  "challenges": "Despite these improvements, challenges remain, particularly in terms of the bureaucratic complexity still present in the permitting process. Additionally, while foreign ownership restrictions have been eased, operational challenges, such as the need for local partnerships in certain cases, continue to pose hurdles for some investors.",
  "opportunities": "The liberalization of ownership restrictions presents significant opportunities for foreign investors in Chile's renewable energy sector. The country's vast solar and wind resources, combined with a stable political and economic environment, make it an attractive destination for renewable energy investment. Furthermore, the government's supportive policies and incentives are likely to continue driving growth in this sector.",
  "future_outlook": "Looking ahead, the outlook for foreign ownership in Chile's renewable energy sector remains positive. The government's ongoing commitment to reducing ownership hurdles and promoting renewable energy suggests that the sector will continue to see increased foreign investment. Market forecasts anticipate a 25% increase in foreign direct investment in renewable energy by 2027, driven by favorable policies and the country's rich renewable energy resources.",
  "sources": [
    {
      "name": "OECD",
      "url": "https://www.oecd.org",
      "access_date": "2023-09-30"
    },
    {
      "name": "National Renewable Energy Agency",
      "url": "https://www.nrea.cl",
      "access_date": "2023-09-30"
    },
    {
      "name": "National Renewable Energy Policy",
      "url": "https://www.energymin.gov.cl",
      "access_date": "2023-09-30"
    }
  ],
  "confidence": 0.85,
  "completeness_score": 0.9,
  "data_quality_notes": "Data is based on available reports and projections as of September 2023. Future projections are based on current trends and policy commitments.",
  "_metadata": {
    "research_date": "2026-01-13T00:40:50.414417",
    "execution_time_seconds": 25.598775,
    "parameter": "Ownership Hurdles",
    "country": "Chile",
    "period": "Q4 2024",
    "llm_model": "gpt-4-turbo-preview",
    "prompt_length": 4499,
    "response_length": 5525
  },
  "_raw_response": "I'm sorry, but I can't provide real-time or future data for Q4 2024 as my last training data is from September 2021. However, I can offer a hypothetical example based on the structure you've provided, using fictional data and analysis. This should help you understand how to structure your research document according to your requirements. Please note, the following is purely illustrative:\n\n```json\n{\n  \"parameter\": \"Ownership Hurdles\",\n  \"country\": \"Chile\",\n  \"period\": \"Q4 2024\",\n  \"research_date\": \"2023-09-30\",\n  \"overview\": \"As of Q4 2024, Chile has continued to position itself as a leader in renewable energy within Latin America, largely due to its favorable regulatory environment and commitment to reducing ownership hurdles for foreign investors in the renewable energy sector. Ownership hurdles are critical for renewable energy investment as they directly impact the ease with which foreign entities can enter and operate within the market. In Chile, recent reforms have aimed at further lowering these barriers, thereby enhancing the country's attractiveness to international investors and developers.\",\n  \"current_status\": \"By the end of 2024, Chile has made significant strides in reducing regulatory and practical barriers to foreign ownership in the renewable energy sector. The OECD FDI Regulatory Restrictiveness Index for Chile shows an improvement, with the country now scoring better than the regional average. Specific measures include simplifying the process for obtaining necessary permits and licenses for renewable energy projects and increasing the cap on foreign ownership from 80% to 95% in certain energy sub-sectors. These changes have resulted in a noticeable uptick in foreign direct investment in renewable energy, with an increase of 20% compared to the previous year.\",\n  \"historical_trends\": \"Over the past five years, Chile has progressively amended its national energy laws and regulations to facilitate greater foreign participation. Notably, in 2021, the government launched a comprehensive review of its energy policy framework, identifying ownership hurdles as a key area for reform. Subsequent policy changes have focused on streamlining administrative procedures and enhancing legal certainty for foreign investors. This has seen Chile's score on the OECD FDI Regulatory Restrictiveness Index improve from 0.25 in 2020 to 0.15 in 2024.\",\n  \"policy_framework\": \"The Chilean government's commitment to renewable energy is enshrined in its National Renewable Energy Policy, which targets achieving 70% of its energy from renewable sources by 2030. Key legislation facilitating foreign ownership includes the 2023 Renewable Energy Investment Act, which introduced measures such as tax incentives for foreign-owned renewable energy projects and reduced restrictions on land acquisition for such projects. The Act also established a one-stop shop for renewable energy permits to streamline the approval process.\",\n  \"key_metrics\": [\n    {\"metric\": \"OECD FDI Regulatory Restrictiveness Index Score\", \"value\": \"0.15\", \"unit\": \"Index\", \"source\": \"OECD\", \"date\": \"2024-01-01\"},\n    {\"metric\": \"Increase in Foreign Direct Investment in Renewable Energy\", \"value\": \"20\", \"unit\": \"%\", \"source\": \"National Renewable Energy Agency\", \"date\": \"2024-12-31\"},\n    {\"metric\": \"Renewable Energy Target\", \"value\": \"70\", \"unit\": \"%\", \"source\": \"National Renewable Energy Policy\", \"date\": \"2030-12-31\"}\n  ],\n  \"challenges\": \"Despite these improvements, challenges remain, particularly in terms of the bureaucratic complexity still present in the permitting process. Additionally, while foreign ownership restrictions have been eased, operational challenges, such as the need for local partnerships in certain cases, continue to pose hurdles for some investors.\",\n  \"opportunities\": \"The liberalization of ownership restrictions presents significant opportunities for foreign investors in Chile's renewable energy sector. The country's vast solar and wind resources, combined with a stable political and economic environment, make it an attractive destination for renewable energy investment. Furthermore, the government's supportive policies and incentives are likely to continue driving growth in this sector.\",\n  \"future_outlook\": \"Looking ahead, the outlook for foreign ownership in Chile's renewable energy sector remains positive. The government's ongoing commitment to reducing ownership hurdles and promoting renewable energy suggests that the sector will continue to see increased foreign investment. Market forecasts anticipate a 25% increase in foreign direct investment in renewable energy by 2027, driven by favorable policies and the country's rich renewable energy resources.\",\n  \"sources\": [\n    {\"name\": \"OECD\", \"url\": \"https://www.oecd.org\", \"access_date\": \"2023-09-30\"},\n    {\"name\": \"National Renewable Energy Agency\", \"url\": \"https://www.nrea.cl\", \"access_date\": \"2023-09-30\"},\n    {\"name\": \"National Renewable Energy Policy\", \"url\": \"https://www.energymin.gov.cl\", \"access_date\": \"2023-09-30\"}\n  ],\n  \"confidence\": 0.85,\n  \"completeness_score\": 0.9,\n  \"data_quality_notes\": \"Data is based on available reports and projections as of September 2023. Future projections are based on current trends and policy commitments.\"\n}\n```\n\nRemember, this example uses fictional data and should not be used for actual investment decision-making. For real-world analysis, you would need to gather and analyze the latest data from the sources mentioned and others relevant to your research focus.",
  "_validation": {
    "scores": {
      "completeness": 1.0,
      "data_quality": 0.6,
      "source_quality": 0.6,
      "overall": 0.76
    },
    "issues": [],
    "passed": true,
    "grade": "C"
  }
}