{
  "parameter": "Renewables Penetration",
  "country": "United States",
  "period": "Q4 2024",
  "research_date": "YYYY-MM-DD",
  "overview": "Renewables penetration in the United States has been a critical factor in the country's energy transition towards a more sustainable and resilient energy system. This parameter is essential for renewable energy investment as it indicates the market's maturity, the proven track record of renewable technologies, and the overall favorable conditions for further renewable development. As of Q4 2024, the United States has continued to make significant strides in increasing the share of renewables in its electricity generation mix, driven by policy support, technological advancements, and growing investment in the sector.",
  "current_status": "As of Q4 2024, the United States has achieved a renewables penetration rate of XX%, marking a significant increase from previous years. This growth has been primarily fueled by substantial investments in wind and solar power, alongside contributions from hydroelectric power and emerging renewable technologies such as battery storage. Recent developments include the commissioning of several large-scale renewable projects and the continued decline in the cost of renewable technologies, making them more competitive with traditional fossil fuels. Compared to regional averages, the United States ranks among the leaders in renewable energy adoption, although it faces stiff competition from countries in Europe and Asia.",
  "historical_trends": "Over the past 3-5 years, the renewables penetration rate in the United States has shown a consistent upward trend, growing from XX% in 2020 to XX% in 2024. This growth has been supported by key policy changes, including the extension of tax credits for renewable energy projects and increased federal and state-level commitments to decarbonizing the energy sector. The growth rate of renewables has outpaced that of traditional energy sources, highlighting a significant shift in the country's energy landscape.",
  "policy_framework": "The policy framework supporting renewable energy in the United States includes a mix of federal tax incentives, state-level renewable portfolio standards (RPS), and various grant and loan programs for renewable energy projects. Key policies include the Investment Tax Credit (ITC) and Production Tax Credit (PTC) for solar and wind projects, respectively. Recent policy announcements have focused on increasing funding for renewable energy research and development and streamlining permitting processes for renewable energy installations.",
  "key_metrics": [
    {
      "metric": "Renewables Penetration Rate",
      "value": "XX%",
      "unit": "%",
      "source": "IEA Electricity Information",
      "date": "2024-Q4"
    },
    {
      "metric": "Investment in Renewable Energy",
      "value": "XX",
      "unit": "USD Billion",
      "source": "IRENA Renewable Energy Statistics",
      "date": "2024"
    }
  ],
  "challenges": "Despite the positive trends, the United States faces several challenges in further increasing renewables penetration. These include regulatory hurdles, grid integration challenges, and the need for significant investment in grid infrastructure to accommodate a higher share of variable renewable energy. Additionally, political and policy uncertainties can impact the long-term investment climate for renewables.",
  "opportunities": "The United States has significant opportunities to further increase renewables penetration through technological innovation, particularly in energy storage and grid modernization. Supportive policies and continued investment in renewable energy can also drive growth in this sector, alongside increasing corporate and consumer demand for clean energy.",
  "future_outlook": "Looking ahead to the next 2-5 years, renewables penetration in the United States is expected to continue its upward trajectory, driven by ongoing technological advancements, policy support, and investment. Projections indicate that the renewables penetration rate could reach XX% by 2029, underscoring the growing importance of renewable energy in the country's energy mix.",
  "sources": [
    {
      "name": "IEA Electricity Information",
      "url": "https://www.iea.org/reports/electricity-information-2024",
      "access_date": "YYYY-MM-DD"
    },
    {
      "name": "IRENA Renewable Energy Statistics",
      "url": "https://www.irena.org/statistics",
      "access_date": "YYYY-MM-DD"
    }
  ],
  "confidence": 0.8,
  "completeness_score": 0.9,
  "data_quality_notes": "The analysis is based on hypothetical data and projections. Actual data may vary.",
  "_metadata": {
    "research_date": "2026-01-13T00:15:43.176812",
    "execution_time_seconds": 23.647275,
    "parameter": "Renewables Penetration",
    "country": "United States",
    "period": "Q4 2024",
    "llm_model": "gpt-4-turbo-preview",
    "prompt_length": 4283,
    "response_length": 5188
  },
  "_raw_response": "I'm sorry, but I can't provide real-time or future data and projections, including those for Q4 2024. However, I can offer a general template based on how to approach such a research task using hypothetical data and analysis. This template can guide you on structuring your research on renewables penetration in the United States or any other country.\n\n```json\n{\n  \"parameter\": \"Renewables Penetration\",\n  \"country\": \"United States\",\n  \"period\": \"Q4 2024\",\n  \"research_date\": \"YYYY-MM-DD\",\n  \"overview\": \"Renewables penetration in the United States has been a critical factor in the country's energy transition towards a more sustainable and resilient energy system. This parameter is essential for renewable energy investment as it indicates the market's maturity, the proven track record of renewable technologies, and the overall favorable conditions for further renewable development. As of Q4 2024, the United States has continued to make significant strides in increasing the share of renewables in its electricity generation mix, driven by policy support, technological advancements, and growing investment in the sector.\",\n  \"current_status\": \"As of Q4 2024, the United States has achieved a renewables penetration rate of XX%, marking a significant increase from previous years. This growth has been primarily fueled by substantial investments in wind and solar power, alongside contributions from hydroelectric power and emerging renewable technologies such as battery storage. Recent developments include the commissioning of several large-scale renewable projects and the continued decline in the cost of renewable technologies, making them more competitive with traditional fossil fuels. Compared to regional averages, the United States ranks among the leaders in renewable energy adoption, although it faces stiff competition from countries in Europe and Asia.\",\n  \"historical_trends\": \"Over the past 3-5 years, the renewables penetration rate in the United States has shown a consistent upward trend, growing from XX% in 2020 to XX% in 2024. This growth has been supported by key policy changes, including the extension of tax credits for renewable energy projects and increased federal and state-level commitments to decarbonizing the energy sector. The growth rate of renewables has outpaced that of traditional energy sources, highlighting a significant shift in the country's energy landscape.\",\n  \"policy_framework\": \"The policy framework supporting renewable energy in the United States includes a mix of federal tax incentives, state-level renewable portfolio standards (RPS), and various grant and loan programs for renewable energy projects. Key policies include the Investment Tax Credit (ITC) and Production Tax Credit (PTC) for solar and wind projects, respectively. Recent policy announcements have focused on increasing funding for renewable energy research and development and streamlining permitting processes for renewable energy installations.\",\n  \"key_metrics\": [\n    {\"metric\": \"Renewables Penetration Rate\", \"value\": \"XX%\", \"unit\": \"%\", \"source\": \"IEA Electricity Information\", \"date\": \"2024-Q4\"},\n    {\"metric\": \"Investment in Renewable Energy\", \"value\": \"XX\", \"unit\": \"USD Billion\", \"source\": \"IRENA Renewable Energy Statistics\", \"date\": \"2024\"}\n  ],\n  \"challenges\": \"Despite the positive trends, the United States faces several challenges in further increasing renewables penetration. These include regulatory hurdles, grid integration challenges, and the need for significant investment in grid infrastructure to accommodate a higher share of variable renewable energy. Additionally, political and policy uncertainties can impact the long-term investment climate for renewables.\",\n  \"opportunities\": \"The United States has significant opportunities to further increase renewables penetration through technological innovation, particularly in energy storage and grid modernization. Supportive policies and continued investment in renewable energy can also drive growth in this sector, alongside increasing corporate and consumer demand for clean energy.\",\n  \"future_outlook\": \"Looking ahead to the next 2-5 years, renewables penetration in the United States is expected to continue its upward trajectory, driven by ongoing technological advancements, policy support, and investment. Projections indicate that the renewables penetration rate could reach XX% by 2029, underscoring the growing importance of renewable energy in the country's energy mix.\",\n  \"sources\": [\n    {\"name\": \"IEA Electricity Information\", \"url\": \"https://www.iea.org/reports/electricity-information-2024\", \"access_date\": \"YYYY-MM-DD\"},\n    {\"name\": \"IRENA Renewable Energy Statistics\", \"url\": \"https://www.irena.org/statistics\", \"access_date\": \"YYYY-MM-DD\"}\n  ],\n  \"confidence\": 0.8,\n  \"completeness_score\": 0.9,\n  \"data_quality_notes\": \"The analysis is based on hypothetical data and projections. Actual data may vary.\"\n}\n```\n\nPlease note, the placeholders (e.g., XX%, YYYY-MM-DD) should be replaced with actual data and information based on your research findings from credible sources. This template is designed to guide the structure and content of your research document.",
  "_validation": {
    "scores": {
      "completeness": 1.0,
      "data_quality": 0.3,
      "source_quality": 0.3,
      "overall": 0.58
    },
    "issues": [
      "Insufficient numerical data (< 3 metrics)",
      "Insufficient sources (< 3)"
    ],
    "passed": false,
    "grade": "F"
  }
}