{
  "parameter": "Status of Grid",
  "country": "Vietnam",
  "period": "Q4 2024",
  "research_date": "2023-09-30",
  "overview": "Vietnam's grid infrastructure is crucial for the country's renewable energy ambitions. High-quality grid infrastructure facilitates the integration of renewable energy sources, such as solar and wind, by ensuring they can reliably and efficiently contribute to the national power supply. As of Q4 2024, Vietnam has been focusing on upgrading its grid to accommodate the growing share of renewables in its energy mix, recognizing the importance of grid quality in reducing curtailment risk and enhancing energy security.",
  "current_status": "As of the last quarter of 2024, Vietnam's grid infrastructure has seen significant improvements, with increased investments in transmission capacity and grid reliability. Recent reports indicate a substantial decrease in SAIDI and SAIFI indices, reflecting enhanced grid reliability. The country has also expanded its transmission capacity to better accommodate the integration of renewable energy sources. However, compared to regional benchmarks, Vietnam still faces challenges in achieving the highest standards of grid infrastructure quality.",
  "historical_trends": "Over the past 3-5 years, Vietnam has demonstrated a strong commitment to improving its grid infrastructure. This period has seen a steady increase in government and private sector investment in grid enhancement projects. Key policy changes aimed at supporting this development include incentives for renewable energy integration and partnerships with international technology providers for grid modernization.",
  "policy_framework": "The Vietnamese government has implemented several policies to support grid improvements, including the Renewable Energy Development Strategy and specific targets for renewable energy capacity. These policies are backed by financial incentives and regulatory support mechanisms designed to encourage both domestic and foreign investment in grid infrastructure.",
  "key_metrics": [
    {
      "metric": "SAIDI",
      "value": "45",
      "unit": "minutes/year",
      "source": "National Energy Regulator",
      "date": "2024-08-01"
    },
    {
      "metric": "Transmission Capacity",
      "value": "15",
      "unit": "GW",
      "source": "Vietnam Electricity",
      "date": "2024-07-15"
    }
  ],
  "challenges": "Despite progress, Vietnam's grid faces challenges related to aging infrastructure in rural areas and the need for further investment to keep pace with the rapid growth of renewable energy. Regulatory hurdles and land acquisition issues also pose significant barriers to the expansion of transmission networks.",
  "opportunities": "Vietnam's commitment to renewable energy and grid modernization presents significant opportunities for investors and technology providers. The government's supportive policy framework and the country's strategic position in Southeast Asia make it an attractive market for renewable energy projects.",
  "future_outlook": "Looking ahead to the next 2-5 years, Vietnam is expected to continue its focus on grid modernization and expansion. Investment in smart grid technologies and energy storage solutions is likely to increase, further enhancing the grid's capacity to integrate renewable energy. Policy adjustments and increased international cooperation are also anticipated to address existing challenges.",
  "sources": [
    {
      "name": "National Energy Regulator",
      "url": "http://example.com",
      "access_date": "2023-09-30"
    },
    {
      "name": "Vietnam Electricity",
      "url": "http://example.com",
      "access_date": "2023-09-30"
    }
  ],
  "confidence": 0.8,
  "completeness_score": 0.9,
  "data_quality_notes": "Data is based on available reports and projections; actual values may vary.",
  "_metadata": {
    "research_date": "2026-01-13T00:37:57.282917",
    "execution_time_seconds": 20.268527,
    "parameter": "Status of Grid",
    "country": "Vietnam",
    "period": "Q4 2024",
    "llm_model": "gpt-4-turbo-preview",
    "prompt_length": 4539,
    "response_length": 4467
  },
  "_raw_response": "I'm sorry, but I can't provide real-time or future data for Q4 2024 as my last training data is from September 2023, and I cannot access or generate real-time data or future predictions. However, I can offer a hypothetical example based on the structure and requirements you've provided. This example will not contain real data but will demonstrate how to structure the research document according to your specifications.\n\n```json\n{\n  \"parameter\": \"Status of Grid\",\n  \"country\": \"Vietnam\",\n  \"period\": \"Q4 2024\",\n  \"research_date\": \"2023-09-30\",\n  \"overview\": \"Vietnam's grid infrastructure is crucial for the country's renewable energy ambitions. High-quality grid infrastructure facilitates the integration of renewable energy sources, such as solar and wind, by ensuring they can reliably and efficiently contribute to the national power supply. As of Q4 2024, Vietnam has been focusing on upgrading its grid to accommodate the growing share of renewables in its energy mix, recognizing the importance of grid quality in reducing curtailment risk and enhancing energy security.\",\n  \"current_status\": \"As of the last quarter of 2024, Vietnam's grid infrastructure has seen significant improvements, with increased investments in transmission capacity and grid reliability. Recent reports indicate a substantial decrease in SAIDI and SAIFI indices, reflecting enhanced grid reliability. The country has also expanded its transmission capacity to better accommodate the integration of renewable energy sources. However, compared to regional benchmarks, Vietnam still faces challenges in achieving the highest standards of grid infrastructure quality.\",\n  \"historical_trends\": \"Over the past 3-5 years, Vietnam has demonstrated a strong commitment to improving its grid infrastructure. This period has seen a steady increase in government and private sector investment in grid enhancement projects. Key policy changes aimed at supporting this development include incentives for renewable energy integration and partnerships with international technology providers for grid modernization.\",\n  \"policy_framework\": \"The Vietnamese government has implemented several policies to support grid improvements, including the Renewable Energy Development Strategy and specific targets for renewable energy capacity. These policies are backed by financial incentives and regulatory support mechanisms designed to encourage both domestic and foreign investment in grid infrastructure.\",\n  \"key_metrics\": [\n    {\"metric\": \"SAIDI\", \"value\": \"45\", \"unit\": \"minutes/year\", \"source\": \"National Energy Regulator\", \"date\": \"2024-08-01\"},\n    {\"metric\": \"Transmission Capacity\", \"value\": \"15\", \"unit\": \"GW\", \"source\": \"Vietnam Electricity\", \"date\": \"2024-07-15\"}\n  ],\n  \"challenges\": \"Despite progress, Vietnam's grid faces challenges related to aging infrastructure in rural areas and the need for further investment to keep pace with the rapid growth of renewable energy. Regulatory hurdles and land acquisition issues also pose significant barriers to the expansion of transmission networks.\",\n  \"opportunities\": \"Vietnam's commitment to renewable energy and grid modernization presents significant opportunities for investors and technology providers. The government's supportive policy framework and the country's strategic position in Southeast Asia make it an attractive market for renewable energy projects.\",\n  \"future_outlook\": \"Looking ahead to the next 2-5 years, Vietnam is expected to continue its focus on grid modernization and expansion. Investment in smart grid technologies and energy storage solutions is likely to increase, further enhancing the grid's capacity to integrate renewable energy. Policy adjustments and increased international cooperation are also anticipated to address existing challenges.\",\n  \"sources\": [\n    {\"name\": \"National Energy Regulator\", \"url\": \"http://example.com\", \"access_date\": \"2023-09-30\"},\n    {\"name\": \"Vietnam Electricity\", \"url\": \"http://example.com\", \"access_date\": \"2023-09-30\"}\n  ],\n  \"confidence\": 0.8,\n  \"completeness_score\": 0.9,\n  \"data_quality_notes\": \"Data is based on available reports and projections; actual values may vary.\"\n}\n```\n\nPlease note, the above is a hypothetical example created to illustrate how to structure a research document based on your requirements. Actual data, sources, and specific details should be gathered through comprehensive research using the data sources and methodologies you've outlined.",
  "_validation": {
    "scores": {
      "completeness": 1.0,
      "data_quality": 0.3,
      "source_quality": 0.3,
      "overall": 0.58
    },
    "issues": [
      "Insufficient numerical data (< 3 metrics)",
      "Insufficient sources (< 3)"
    ],
    "passed": false,
    "grade": "F"
  }
}