{
  "parameter": "Ownership Consolidation",
  "country": "United Kingdom",
  "period": "Q4 2024",
  "research_date": "2023-09-30",
  "overview": "In the context of the United Kingdom, ownership consolidation within the renewable energy sector is a critical parameter for understanding market dynamics and investment potential. This parameter is indicative of the level of competition and diversity among asset owners in the renewable energy market. A lower consolidation score suggests a more competitive market with a wide range of participants, which can foster innovation and drive down costs. As of Q4 2024, the UK's renewable energy market is characterized by moderate consolidation, reflecting a balanced competitive landscape.",
  "current_status": "As of the last quarter of 2024, the top three owners of renewable energy assets in the UK control approximately 45% of the market. This indicates a moderate level of consolidation, with a significant portion of the market held by a variety of other players, including smaller independent producers and community-owned projects. Recent developments, such as increased investment in offshore wind and solar energy, have attracted a diverse range of investors, further diluting the market concentration. Compared to regional averages in Europe, where top three owners in many countries control over 50% of the market, the UK presents a more competitive landscape.",
  "historical_trends": "Over the past five years, the UK's renewable energy market has seen a gradual decrease in ownership consolidation. In 2019, the top three owners controlled approximately 55% of the market. This shift can be attributed to policy changes encouraging small-scale renewable projects and the entry of international investors attracted by the UK's commitment to renewable energy.",
  "policy_framework": "The UK government has implemented several policies aimed at reducing market consolidation, including incentives for small-scale renewable energy projects and streamlined licensing processes for new entrants. The government's commitment to achieving net-zero emissions by 2050 has also driven investment in a diverse range of renewable energy sources, further supporting a competitive market.",
  "key_metrics": [
    {
      "metric": "Top 3 owners market control",
      "value": "45",
      "unit": "%",
      "source": "Hypothetical Renewable Energy Market Report",
      "date": "2024-12-31"
    },
    {
      "metric": "Net-zero emissions target year",
      "value": "2050",
      "unit": "Year",
      "source": "UK Government Policy Document",
      "date": "2023-01-01"
    }
  ],
  "challenges": "Despite a relatively competitive market, challenges remain, including regulatory hurdles for new entrants and the need for significant investment in grid infrastructure to support a diverse range of renewable energy sources.",
  "opportunities": "The UK's commitment to renewable energy and its moderate level of market consolidation present significant opportunities for new entrants and investors. The growing demand for green energy and the government's supportive policies create a conducive environment for investment.",
  "future_outlook": "Looking ahead to the next 2-5 years, the UK's renewable energy market is expected to become increasingly competitive, with further decreases in ownership consolidation. This trend will likely be supported by ongoing policy initiatives and the growing attractiveness of the UK as a hub for renewable energy investment.",
  "sources": [
    {
      "name": "Hypothetical Renewable Energy Market Report",
      "url": "http://example.com/renewable-report",
      "access_date": "2023-09-30"
    },
    {
      "name": "UK Government Policy Document",
      "url": "http://example.gov.uk/policy-document",
      "access_date": "2023-09-30"
    }
  ],
  "confidence": 0.85,
  "completeness_score": 0.9,
  "data_quality_notes": "The data presented is based on hypothetical examples and should be verified with actual market reports and government documents.",
  "_metadata": {
    "research_date": "2026-01-13T00:43:08.245633",
    "execution_time_seconds": 22.532196,
    "parameter": "Ownership Consolidation",
    "country": "United Kingdom",
    "period": "Q4 2024",
    "llm_model": "gpt-4-turbo-preview",
    "prompt_length": 4448,
    "response_length": 4801
  },
  "_raw_response": "I'm sorry, but I can't provide real-time or future data, including projections for Q4 2024 or create content based on such specific future-oriented requests. However, I can offer guidance on how to structure your research and what kind of information to look for based on historical and current trends up to my last knowledge update in September 2023. If you're conducting this research, here's a framework you might follow, filled with hypothetical examples to illustrate how you could approach each section:\n\n```json\n{\n  \"parameter\": \"Ownership Consolidation\",\n  \"country\": \"United Kingdom\",\n  \"period\": \"Q4 2024\",\n  \"research_date\": \"2023-09-30\",\n  \"overview\": \"In the context of the United Kingdom, ownership consolidation within the renewable energy sector is a critical parameter for understanding market dynamics and investment potential. This parameter is indicative of the level of competition and diversity among asset owners in the renewable energy market. A lower consolidation score suggests a more competitive market with a wide range of participants, which can foster innovation and drive down costs. As of Q4 2024, the UK's renewable energy market is characterized by moderate consolidation, reflecting a balanced competitive landscape.\",\n  \"current_status\": \"As of the last quarter of 2024, the top three owners of renewable energy assets in the UK control approximately 45% of the market. This indicates a moderate level of consolidation, with a significant portion of the market held by a variety of other players, including smaller independent producers and community-owned projects. Recent developments, such as increased investment in offshore wind and solar energy, have attracted a diverse range of investors, further diluting the market concentration. Compared to regional averages in Europe, where top three owners in many countries control over 50% of the market, the UK presents a more competitive landscape.\",\n  \"historical_trends\": \"Over the past five years, the UK's renewable energy market has seen a gradual decrease in ownership consolidation. In 2019, the top three owners controlled approximately 55% of the market. This shift can be attributed to policy changes encouraging small-scale renewable projects and the entry of international investors attracted by the UK's commitment to renewable energy.\",\n  \"policy_framework\": \"The UK government has implemented several policies aimed at reducing market consolidation, including incentives for small-scale renewable energy projects and streamlined licensing processes for new entrants. The government's commitment to achieving net-zero emissions by 2050 has also driven investment in a diverse range of renewable energy sources, further supporting a competitive market.\",\n  \"key_metrics\": [\n    {\"metric\": \"Top 3 owners market control\", \"value\": \"45\", \"unit\": \"%\", \"source\": \"Hypothetical Renewable Energy Market Report\", \"date\": \"2024-12-31\"},\n    {\"metric\": \"Net-zero emissions target year\", \"value\": \"2050\", \"unit\": \"Year\", \"source\": \"UK Government Policy Document\", \"date\": \"2023-01-01\"}\n  ],\n  \"challenges\": \"Despite a relatively competitive market, challenges remain, including regulatory hurdles for new entrants and the need for significant investment in grid infrastructure to support a diverse range of renewable energy sources.\",\n  \"opportunities\": \"The UK's commitment to renewable energy and its moderate level of market consolidation present significant opportunities for new entrants and investors. The growing demand for green energy and the government's supportive policies create a conducive environment for investment.\",\n  \"future_outlook\": \"Looking ahead to the next 2-5 years, the UK's renewable energy market is expected to become increasingly competitive, with further decreases in ownership consolidation. This trend will likely be supported by ongoing policy initiatives and the growing attractiveness of the UK as a hub for renewable energy investment.\",\n  \"sources\": [\n    {\"name\": \"Hypothetical Renewable Energy Market Report\", \"url\": \"http://example.com/renewable-report\", \"access_date\": \"2023-09-30\"},\n    {\"name\": \"UK Government Policy Document\", \"url\": \"http://example.gov.uk/policy-document\", \"access_date\": \"2023-09-30\"}\n  ],\n  \"confidence\": 0.85,\n  \"completeness_score\": 0.9,\n  \"data_quality_notes\": \"The data presented is based on hypothetical examples and should be verified with actual market reports and government documents.\"\n}\n```\n\nThis example framework is designed to guide you through structuring your research on ownership consolidation in the UK's renewable energy sector for Q4 2024. Remember, the actual analysis will require accessing up-to-date market reports, government documents, and industry data to fill in the specific metrics, trends, and forecasts accurately.",
  "_validation": {
    "scores": {
      "completeness": 1.0,
      "data_quality": 0.3,
      "source_quality": 0.3,
      "overall": 0.58
    },
    "issues": [
      "Insufficient numerical data (< 3 metrics)",
      "Insufficient sources (< 3)"
    ],
    "passed": false,
    "grade": "F"
  }
}