{
  "parameter": "Ownership Consolidation",
  "country": "China",
  "period": "Q4 2024",
  "research_date": "2023-09-30",
  "overview": "As of Q4 2024, the renewable energy market in China has seen significant shifts in ownership consolidation. This parameter is crucial for understanding the competitive landscape and investment potential within the country's renewable sector. Ownership consolidation affects market dynamics, influencing innovation, pricing, and the availability of renewable energy sources. The current state reflects a moderately consolidated market, driven by government policies favoring a diverse set of players and technological advancements.",
  "current_status": "The top three owners of renewable energy assets in China control approximately 45% of the market as of Q4 2024. This indicates a moderate level of consolidation, with a healthy mix of state-owned enterprises, private domestic companies, and foreign entities contributing to the market. Recent developments, such as the Chinese government's push for green energy and the introduction of favorable subsidies, have encouraged smaller players to enter the market, slightly reducing the degree of consolidation seen in previous years.",
  "historical_trends": "Over the past 3-5 years, the renewable energy market in China has transitioned from high consolidation, where the top three owners controlled around 60% of the market, to a more competitive landscape. This shift was largely due to policy changes aimed at reducing barriers to entry and promoting innovation within the sector.",
  "policy_framework": "The Chinese government has implemented several policies to encourage diversity in renewable energy ownership. These include tax incentives for small and medium-sized enterprises (SMEs) and regulations that limit the maximum market share any single entity can control. The government's commitment to achieving carbon neutrality by 2060 has also played a significant role in shaping these policies.",
  "key_metrics": [
    {
      "metric": "Market Share of Top 3 Owners",
      "value": "45",
      "unit": "%",
      "source": "Hypothetical Renewable Energy Market Report",
      "date": "2024-10-01"
    },
    {
      "metric": "Number of Renewable Energy Players",
      "value": "200+",
      "unit": "Entities",
      "source": "Hypothetical Renewable Energy Market Report",
      "date": "2024-10-01"
    }
  ],
  "challenges": "Despite a more competitive market, challenges remain, including regulatory hurdles that disproportionately affect smaller players and the need for significant capital to compete effectively. Additionally, the infrastructure for renewable energy distribution favors larger, established companies.",
  "opportunities": "The shift towards a less consolidated market has opened up opportunities for innovation and investment, particularly in niche areas such as offshore wind and solar storage solutions. Government policies supporting SMEs and startups have also created a more dynamic market environment.",
  "future_outlook": "The trend towards deconsolidation is expected to continue over the next 2-5 years, with the market share of the top three owners projected to drop below 40%. This will likely result in increased competition, lower prices, and greater innovation within China's renewable energy sector.",
  "sources": [
    {
      "name": "Hypothetical Renewable Energy Market Report",
      "url": "http://example.com",
      "access_date": "2023-09-30"
    }
  ],
  "confidence": 0.8,
  "completeness_score": 0.9,
  "data_quality_notes": "This analysis is based on hypothetical data and should be used for illustrative purposes only.",
  "_metadata": {
    "research_date": "2026-01-13T00:42:23.292052",
    "execution_time_seconds": 19.765754,
    "parameter": "Ownership Consolidation",
    "country": "China",
    "period": "Q4 2024",
    "llm_model": "gpt-4-turbo-preview",
    "prompt_length": 4430,
    "response_length": 4461
  },
  "_raw_response": "I'm sorry, but I can't provide real-time or future data predictions for Q4 2024 or generate content based on specific future dates, as my training only includes information up to September 2021. However, I can offer a hypothetical example based on trends and policies up to my last update in 2021, which might help you understand how to approach such a task. Please note that the following is a fictional example and should not be considered accurate or reflective of current or future states.\n\n```json\n{\n  \"parameter\": \"Ownership Consolidation\",\n  \"country\": \"China\",\n  \"period\": \"Q4 2024\",\n  \"research_date\": \"2023-09-30\",\n  \"overview\": \"As of Q4 2024, the renewable energy market in China has seen significant shifts in ownership consolidation. This parameter is crucial for understanding the competitive landscape and investment potential within the country's renewable sector. Ownership consolidation affects market dynamics, influencing innovation, pricing, and the availability of renewable energy sources. The current state reflects a moderately consolidated market, driven by government policies favoring a diverse set of players and technological advancements.\",\n  \"current_status\": \"The top three owners of renewable energy assets in China control approximately 45% of the market as of Q4 2024. This indicates a moderate level of consolidation, with a healthy mix of state-owned enterprises, private domestic companies, and foreign entities contributing to the market. Recent developments, such as the Chinese government's push for green energy and the introduction of favorable subsidies, have encouraged smaller players to enter the market, slightly reducing the degree of consolidation seen in previous years.\",\n  \"historical_trends\": \"Over the past 3-5 years, the renewable energy market in China has transitioned from high consolidation, where the top three owners controlled around 60% of the market, to a more competitive landscape. This shift was largely due to policy changes aimed at reducing barriers to entry and promoting innovation within the sector.\",\n  \"policy_framework\": \"The Chinese government has implemented several policies to encourage diversity in renewable energy ownership. These include tax incentives for small and medium-sized enterprises (SMEs) and regulations that limit the maximum market share any single entity can control. The government's commitment to achieving carbon neutrality by 2060 has also played a significant role in shaping these policies.\",\n  \"key_metrics\": [\n    {\"metric\": \"Market Share of Top 3 Owners\", \"value\": \"45\", \"unit\": \"%\", \"source\": \"Hypothetical Renewable Energy Market Report\", \"date\": \"2024-10-01\"},\n    {\"metric\": \"Number of Renewable Energy Players\", \"value\": \"200+\", \"unit\": \"Entities\", \"source\": \"Hypothetical Renewable Energy Market Report\", \"date\": \"2024-10-01\"}\n  ],\n  \"challenges\": \"Despite a more competitive market, challenges remain, including regulatory hurdles that disproportionately affect smaller players and the need for significant capital to compete effectively. Additionally, the infrastructure for renewable energy distribution favors larger, established companies.\",\n  \"opportunities\": \"The shift towards a less consolidated market has opened up opportunities for innovation and investment, particularly in niche areas such as offshore wind and solar storage solutions. Government policies supporting SMEs and startups have also created a more dynamic market environment.\",\n  \"future_outlook\": \"The trend towards deconsolidation is expected to continue over the next 2-5 years, with the market share of the top three owners projected to drop below 40%. This will likely result in increased competition, lower prices, and greater innovation within China's renewable energy sector.\",\n  \"sources\": [\n    {\"name\": \"Hypothetical Renewable Energy Market Report\", \"url\": \"http://example.com\", \"access_date\": \"2023-09-30\"}\n  ],\n  \"confidence\": 0.8,\n  \"completeness_score\": 0.9,\n  \"data_quality_notes\": \"This analysis is based on hypothetical data and should be used for illustrative purposes only.\"\n}\n```\n\nThis example showcases how to structure a comprehensive research document on ownership consolidation in China's renewable energy market, including an overview, current status, historical trends, policy framework, key metrics, challenges, opportunities, and future outlook. Remember, the data and sources provided here are fictional and for illustrative purposes only.",
  "_validation": {
    "scores": {
      "completeness": 1.0,
      "data_quality": 0.3,
      "source_quality": 0.3,
      "overall": 0.58
    },
    "issues": [
      "Insufficient numerical data (< 3 metrics)",
      "Insufficient sources (< 3)"
    ],
    "passed": false,
    "grade": "F"
  }
}