{
  "parameter": "Country Stability",
  "country": "India",
  "period": "Q4 2024",
  "research_date": "YYYY-MM-DD",
  "overview": "Country stability is crucial for renewable energy investments as it influences regulatory, financial, and market risks. In the context of India, a nation with a rapidly growing economy and an increasing focus on renewable energy, understanding political and economic stability becomes paramount. As of Q4 2024, India's commitment to expanding its renewable energy capacity amidst its socio-political and economic landscape plays a significant role in attracting global investors.",
  "current_status": "As of the latest data, India's political environment remains vibrant with democratic processes and regular elections. Economic policies have been increasingly favorable towards renewable energy, with significant investments in infrastructure. However, challenges remain in terms of regulatory consistency and land acquisition processes. Recent developments include...",
  "historical_trends": "Over the past 3-5 years, India has seen a steady improvement in its ECR rating, reflecting growing political stability and economic reforms. Key policy changes such as the National Solar Mission and amendments to the Electricity Act have bolstered investor confidence...",
  "policy_framework": "India's renewable energy policy framework includes the National Solar Mission, with a target of 100 GW by 2022, and the National Wind-Solar Hybrid Policy. Recent policy announcements include...",
  "key_metrics": [
    {
      "metric": "ECR rating",
      "value": "4.5",
      "unit": "score",
      "source": "Euromoney Country Risk",
      "date": "2024-10-01"
    },
    {
      "metric": "Renewable energy capacity",
      "value": "150",
      "unit": "GW",
      "source": "Ministry of New and Renewable Energy",
      "date": "2024-09-30"
    }
  ],
  "challenges": "Key challenges include regulatory hurdles such as delays in project approvals and land acquisition issues. Market constraints also exist, including the financial health of state electricity boards...",
  "opportunities": "India presents significant opportunities in the renewable energy sector, driven by supportive government policies, a large market potential, and an increasing focus on sustainability...",
  "future_outlook": "The outlook for the next 2-5 years is positive, with expectations of continued policy support and market growth. Projections include reaching 200 GW of renewable energy capacity by 2026...",
  "sources": [
    {
      "name": "Euromoney Country Risk",
      "url": "https://www.euromoney.com/country-risk",
      "access_date": "YYYY-MM-DD"
    },
    {
      "name": "Ministry of New and Renewable Energy",
      "url": "https://mnre.gov.in/",
      "access_date": "YYYY-MM-DD"
    }
  ],
  "confidence": 0.8,
  "completeness_score": 0.9,
  "data_quality_notes": "Data is based on projections and available reports as of September 2021. Actual figures may vary.",
  "_metadata": {
    "research_date": "2026-01-12T23:54:53.379508",
    "execution_time_seconds": 19.485665,
    "parameter": "Country Stability",
    "country": "India",
    "period": "Q4 2024",
    "llm_model": "gpt-4-turbo-preview",
    "prompt_length": 4119,
    "response_length": 3692
  },
  "_raw_response": "I'm sorry, but I can't provide real-time or future data, including predictions or analyses for Q4 2024, as my training data only goes up until September 2021. However, I can offer guidance on how to approach such a research task based on historical and current knowledge up to my last update. If you're looking for a structured approach to researching and analyzing the parameter of country stability for India with a focus on renewable energy investment, here's how you might structure your research document, using hypothetical or illustrative data:\n\n```json\n{\n  \"parameter\": \"Country Stability\",\n  \"country\": \"India\",\n  \"period\": \"Q4 2024\",\n  \"research_date\": \"YYYY-MM-DD\",\n  \"overview\": \"Country stability is crucial for renewable energy investments as it influences regulatory, financial, and market risks. In the context of India, a nation with a rapidly growing economy and an increasing focus on renewable energy, understanding political and economic stability becomes paramount. As of Q4 2024, India's commitment to expanding its renewable energy capacity amidst its socio-political and economic landscape plays a significant role in attracting global investors.\",\n  \"current_status\": \"As of the latest data, India's political environment remains vibrant with democratic processes and regular elections. Economic policies have been increasingly favorable towards renewable energy, with significant investments in infrastructure. However, challenges remain in terms of regulatory consistency and land acquisition processes. Recent developments include...\",\n  \"historical_trends\": \"Over the past 3-5 years, India has seen a steady improvement in its ECR rating, reflecting growing political stability and economic reforms. Key policy changes such as the National Solar Mission and amendments to the Electricity Act have bolstered investor confidence...\",\n  \"policy_framework\": \"India's renewable energy policy framework includes the National Solar Mission, with a target of 100 GW by 2022, and the National Wind-Solar Hybrid Policy. Recent policy announcements include...\",\n  \"key_metrics\": [\n    {\"metric\": \"ECR rating\", \"value\": \"4.5\", \"unit\": \"score\", \"source\": \"Euromoney Country Risk\", \"date\": \"2024-10-01\"},\n    {\"metric\": \"Renewable energy capacity\", \"value\": \"150\", \"unit\": \"GW\", \"source\": \"Ministry of New and Renewable Energy\", \"date\": \"2024-09-30\"}\n  ],\n  \"challenges\": \"Key challenges include regulatory hurdles such as delays in project approvals and land acquisition issues. Market constraints also exist, including the financial health of state electricity boards...\",\n  \"opportunities\": \"India presents significant opportunities in the renewable energy sector, driven by supportive government policies, a large market potential, and an increasing focus on sustainability...\",\n  \"future_outlook\": \"The outlook for the next 2-5 years is positive, with expectations of continued policy support and market growth. Projections include reaching 200 GW of renewable energy capacity by 2026...\",\n  \"sources\": [\n    {\"name\": \"Euromoney Country Risk\", \"url\": \"https://www.euromoney.com/country-risk\", \"access_date\": \"YYYY-MM-DD\"},\n    {\"name\": \"Ministry of New and Renewable Energy\", \"url\": \"https://mnre.gov.in/\", \"access_date\": \"YYYY-MM-DD\"}\n  ],\n  \"confidence\": 0.8,\n  \"completeness_score\": 0.9,\n  \"data_quality_notes\": \"Data is based on projections and available reports as of September 2021. Actual figures may vary.\"\n}\n```\n\nPlease note, the above JSON is a structured approach to how you might format your research findings. The data provided within is illustrative and should be replaced with actual research data and analysis relevant to the specified period and context.",
  "_validation": {
    "scores": {
      "completeness": 1.0,
      "data_quality": 0.3,
      "source_quality": 0.3,
      "overall": 0.58
    },
    "issues": [
      "Insufficient numerical data (< 3 metrics)",
      "Insufficient sources (< 3)"
    ],
    "passed": false,
    "grade": "F"
  }
}