{
  "parameter": "Energy Dependence",
  "country": "Germany",
  "period": "Q4 2024",
  "research_date": "2023-09-30",
  "overview": "Germany has historically been highly dependent on energy imports, particularly in natural gas, oil, and coal, due to its limited domestic fossil fuel resources. This dependence has significant implications for renewable energy investment, as the country seeks to enhance its energy security, reduce carbon emissions, and transition towards a more sustainable energy mix. The shift towards renewables is not only a strategic move to reduce import dependency but also aligns with Germany's ambitious climate goals, including becoming carbon neutral by 2045.",
  "current_status": "As of the last available data, Germany's energy mix is undergoing significant transformation, with renewable energy sources like wind, solar, and biomass increasing their share. However, the country still relies heavily on energy imports, especially for oil and natural gas. Recent geopolitical events have underscored the risks associated with this dependency, accelerating efforts to diversify energy sources and increase domestic renewable energy production.",
  "historical_trends": "Over the past 3-5 years, Germany has intensified its focus on reducing energy dependence through the Energiewende, its comprehensive energy transition policy. This has involved substantial investments in renewable energy infrastructure, improvements in energy efficiency, and the gradual phasing out of nuclear power and coal.",
  "policy_framework": "Germany's policy framework supporting renewable energy expansion includes the Renewable Energy Sources Act (EEG), which provides financial incentives for renewable energy production, and the Climate Action Plan 2050, outlining pathways to achieve greenhouse gas neutrality. Recent policy announcements have focused on accelerating wind and solar energy deployment, improving grid infrastructure, and increasing funding for renewable energy research and development.",
  "key_metrics": [
    {
      "metric": "Energy import dependency",
      "value": "60%",
      "unit": "%",
      "source": "IEA World Energy Balances",
      "date": "2023"
    },
    {
      "metric": "Renewable energy share in electricity generation",
      "value": "40%",
      "unit": "%",
      "source": "National energy statistics",
      "date": "2023"
    }
  ],
  "challenges": "Germany faces several challenges in reducing its energy dependence, including the need for substantial investment in renewable energy infrastructure, regulatory hurdles related to land use and permitting for new energy projects, and the technical challenge of integrating variable renewable energy sources into the power grid.",
  "opportunities": "Opportunities for Germany to reduce its energy dependence include leveraging its strong industrial base to become a leader in renewable energy technology, expanding cross-border energy cooperation within the EU, and harnessing its significant offshore wind potential.",
  "future_outlook": "Looking ahead, Germany is expected to continue its transition towards a more sustainable and less import-dependent energy system. This will likely involve further policy support for renewable energy, increased investment in energy storage and grid infrastructure, and greater emphasis on energy efficiency measures.",
  "sources": [
    {
      "name": "IEA World Energy Balances",
      "url": "https://www.iea.org/reports/world-energy-balances-overview",
      "access_date": "2023-09-30"
    },
    {
      "name": "BP Statistical Review of World Energy",
      "url": "https://www.bp.com/en/global/corporate/energy-economics/statistical-review-of-world-energy.html",
      "access_date": "2023-09-30"
    },
    {
      "name": "National energy statistics",
      "url": "",
      "access_date": "2023-09-30"
    }
  ],
  "confidence": 0.8,
  "completeness_score": 0.9,
  "data_quality_notes": "The analysis is based on historical data and trends. Future projections are speculative and should be validated with the most current data.",
  "_metadata": {
    "research_date": "2026-01-13T00:11:48.746115",
    "execution_time_seconds": 18.805644,
    "parameter": "Energy Dependence",
    "country": "Germany",
    "period": "Q4 2024",
    "llm_model": "gpt-4-turbo-preview",
    "prompt_length": 4117,
    "response_length": 4667
  },
  "_raw_response": "I'm sorry, but I can't provide real-time or future data, including predictions for Q4 2024 or create documents based on such data. However, I can offer a general framework based on historical data and trends up to my last knowledge update in September 2023. For actual forecasts, specific numbers, and the most current policies, please consult the latest reports from authoritative sources like the IEA, national energy departments, or industry research firms. \n\n---\n\n{\n  \"parameter\": \"Energy Dependence\",\n  \"country\": \"Germany\",\n  \"period\": \"Q4 2024\",\n  \"research_date\": \"2023-09-30\",\n  \"overview\": \"Germany has historically been highly dependent on energy imports, particularly in natural gas, oil, and coal, due to its limited domestic fossil fuel resources. This dependence has significant implications for renewable energy investment, as the country seeks to enhance its energy security, reduce carbon emissions, and transition towards a more sustainable energy mix. The shift towards renewables is not only a strategic move to reduce import dependency but also aligns with Germany's ambitious climate goals, including becoming carbon neutral by 2045.\",\n  \"current_status\": \"As of the last available data, Germany's energy mix is undergoing significant transformation, with renewable energy sources like wind, solar, and biomass increasing their share. However, the country still relies heavily on energy imports, especially for oil and natural gas. Recent geopolitical events have underscored the risks associated with this dependency, accelerating efforts to diversify energy sources and increase domestic renewable energy production.\",\n  \"historical_trends\": \"Over the past 3-5 years, Germany has intensified its focus on reducing energy dependence through the Energiewende, its comprehensive energy transition policy. This has involved substantial investments in renewable energy infrastructure, improvements in energy efficiency, and the gradual phasing out of nuclear power and coal.\",\n  \"policy_framework\": \"Germany's policy framework supporting renewable energy expansion includes the Renewable Energy Sources Act (EEG), which provides financial incentives for renewable energy production, and the Climate Action Plan 2050, outlining pathways to achieve greenhouse gas neutrality. Recent policy announcements have focused on accelerating wind and solar energy deployment, improving grid infrastructure, and increasing funding for renewable energy research and development.\",\n  \"key_metrics\": [\n    {\"metric\": \"Energy import dependency\", \"value\": \"60%\", \"unit\": \"%\", \"source\": \"IEA World Energy Balances\", \"date\": \"2023\"},\n    {\"metric\": \"Renewable energy share in electricity generation\", \"value\": \"40%\", \"unit\": \"%\", \"source\": \"National energy statistics\", \"date\": \"2023\"}\n  ],\n  \"challenges\": \"Germany faces several challenges in reducing its energy dependence, including the need for substantial investment in renewable energy infrastructure, regulatory hurdles related to land use and permitting for new energy projects, and the technical challenge of integrating variable renewable energy sources into the power grid.\",\n  \"opportunities\": \"Opportunities for Germany to reduce its energy dependence include leveraging its strong industrial base to become a leader in renewable energy technology, expanding cross-border energy cooperation within the EU, and harnessing its significant offshore wind potential.\",\n  \"future_outlook\": \"Looking ahead, Germany is expected to continue its transition towards a more sustainable and less import-dependent energy system. This will likely involve further policy support for renewable energy, increased investment in energy storage and grid infrastructure, and greater emphasis on energy efficiency measures.\",\n  \"sources\": [\n    {\"name\": \"IEA World Energy Balances\", \"url\": \"https://www.iea.org/reports/world-energy-balances-overview\", \"access_date\": \"2023-09-30\"},\n    {\"name\": \"BP Statistical Review of World Energy\", \"url\": \"https://www.bp.com/en/global/corporate/energy-economics/statistical-review-of-world-energy.html\", \"access_date\": \"2023-09-30\"},\n    {\"name\": \"National energy statistics\", \"url\": \"\", \"access_date\": \"2023-09-30\"}\n  ],\n  \"confidence\": 0.8,\n  \"completeness_score\": 0.9,\n  \"data_quality_notes\": \"The analysis is based on historical data and trends. Future projections are speculative and should be validated with the most current data.\"\n}\n\n---\n\nPlease note that the above JSON structure is a hypothetical example based on historical trends and policies up to 2023. For the most accurate and up-to-date information, consult the latest reports and data directly from the sources mentioned.",
  "_validation": {
    "scores": {
      "completeness": 1.0,
      "data_quality": 0.3,
      "source_quality": 0.6,
      "overall": 0.6699999999999999
    },
    "issues": [
      "Insufficient numerical data (< 3 metrics)"
    ],
    "passed": true,
    "grade": "D"
  }
}